how to search anonymously,how to search anonymously,1.0
how to browse anonymously on android,how to search anonymously,0.57229202105170118
anonymous browsing sites,how to search anonymously,0.63731800984936027
surf anonymously online,how to search anonymously,0.64717296104214839
hide browsing from employer,how to search anonymously,0.6036389695631309
best anonymous browser,how to search anonymously,0.6995688594220677
tor for android safe,how to browse anonymously on android,0.63484183023097074
best proxy server,anonymous browsing sites,0.55277808626527514
anonymous web surfing,surf anonymously online,0.5977944696211801
hide me proxy,surf anonymously online,0.5592816157253383
anonymous browsing chrome,surf anonymously online,0.64840046592962319
hide internet activity from employer,hide browsing from employer,0.55345897840291303
how to hide your internet activity,hide browsing from employer,0.62096840348366844
how to hide internet activity from provider,hide browsing from employer,0.63133332184926194
best anonymous browser android,best anonymous browser,0.65550722611081036
anonymous browser online,best anonymous browser,0.66758074631684428
anonymous browser download,best anonymous browser,0.62589045174838864
