twitter unlocker,how to view private twitter account,0.33684676154749305
twitter unlocker download,private twitter viewer,0.29852197132899305
twtroulette,private twitter viewer,0.23637540067349783
twitter unlocker online,twitter unlocker,0.33893819780298406
tweet unlock,twitter unlocker,0.4160667958308808
twintrude twitter,view private twitter 2016,0.40986552344995608
twtroulette twitter,twtroulette,0.3035302745852273
twtroulette 2016,twtroulette,0.30376892869903172
twitter spy app,twtroulette,0.34241160050588559
how to make twitter private on app,how to change twitter privacy settings,0.51370331364343313
how to make twitter private on android,how to make twitter private on app,0.54752585627328221
someone favorited my tweet but i cant see who,protected account twitter likes,0.48542089714644743
someone favorited my tweet but it says no users,protected account twitter likes,0.54325215360865142
cant see who liked my tweet,twitter protected account liked,0.54871317968426336
how to see who favorited a tweet,protected account twitter liked my tweet,0.52662997175134363
how to see who favorited someone elses tweet,protected account twitter liked my tweet,0.54307067888008131
who liked my tweet,someone favorited my tweet but i cant see who,0.54660174936255712
how to private twitter account using phone,how to make twitter private on app,0.73241892471690706
private twitter account,how to make twitter private on android,0.5724266260960662
twitter private profile viewer  unlocker,twitter unlocker,0.61381985113345316
twitter unlock protected tweets,twitter unlocker,0.74426449203005329
how to view someones private twitter without following them,twtroulette,0.78293229294729239
view private tweets,twtroulette,0.81563019733893594
someone liked my tweet but i cant see who,someone favorited my tweet but i cant see who,0.68653742424600983
who favorited my tweets the most,someone favorited my tweet but i cant see who,0.58001251383945562
why cant i see who favorited my tweet,someone favorited my tweet but it says no users,0.60837140050606175
how to see who favorited someones tweet,cant see who liked my tweet,0.66544665875112519
