how to encrypt text messages,how to encrypt text messages,1.0
encrypted text messages iphone,how to encrypt text messages,0.81097143612215261
encrypt text online,how to encrypt text messages,0.58925873666937922
encrypted message app,how to encrypt text messages,0.60713953103006957
how to decrypt a message,how to encrypt text messages,0.61570825403528573
encrypted message meaning,how to encrypt text messages,0.5882701498117523
encrypt text messages android,encrypted text messages iphone,0.76383270911231371
encrypted messaging app android,encrypted text messages iphone,0.69672182623303047
encrypted messaging app iphone,encrypted text messages iphone,0.75658542866499323
secure messaging app iphone,encrypted text messages iphone,0.72142592232974578
decrypt text online without key,encrypt text online,0.70579751813151737
text encryption software,encrypt text online,0.60543513237450375
encrypted message generator,encrypt text online,0.60246124758475239
most secure messaging app 2016,encrypted message app,0.61648845233430583
secure messaging app android,encrypted message app,0.66893155064517695
best private messaging app,encrypted message app,0.6272730869976485
encrypted messaging service,encrypted message app,0.59636584173729046
decrypt message without key,how to decrypt a message,0.57575968034275216
decrypt message online,how to decrypt a message,0.64580877249462099
online decryption tool without key,how to decrypt a message,0.63921352249550678
most secure chat app android,secure messaging app iphone,0.6192498399188463
