delete your snapchat account,0.87068028040032375
what happens when you delete snapchat account,0.8357732871544058
delete snapchat chat account,0.8837537201244835
snapchat support delete account,0.80739070175849215
how to deactivate snapchat,0.93237496581349533
if i delete my snapchat will it delete sent snaps,0.61727262051457776
snapchat com delete account,0.90707137181579345
how to deactivate snapchat 2016,0.84807383236115697
snapchatcom delete account,0.78254779545890374
how to deactivate snapchat android,0.90497885411064094
how to delete snapchat account on iphone,0.86581930753134762
how to delete snapchat,0.59214437647729201
how to delete snapchat account android,0.83453065204761823
