how to hide texts on iphone 6,hide instagram from government,0.25949857686203259
hiddenconvos ios 9,how to hide messages on iphone without deleting,0.27752810371418296
hide numbers from cell phone bill,app to hide text messages from phone bill,0.28071158461771922
how to hide numbers on att phone bill,app to hide text messages from phone bill,0.3010775080348832
how to block a phone number from showing up on your bill,app to hide text messages from phone bill,0.30969922101305181
apps for catching cheaters,how to find hidden text messages,0.22626624546195703
hiddenconvos download,hidden convos,0.3028985450905774
hiddenconvos pro,hidden convos,0.26853171131532433
how to hide whatsapp contact picture,hide contacts whatsapp,0.3138167660266335
