encrypted messenger facebook,encrypted message app,0.27241830007283641
decrypt password hash,how to decrypt a message,0.35531719533877576
encrypted means in tagalog,encrypted message meaning,0.19360075823447251
decryption meaning,encrypted message meaning,0.33401914720783643
encrypted meaning in english,encrypted message meaning,0.34194175318566128
encrypted synonym,encrypted message meaning,0.27234810787899955
secure instant messaging,encrypted messaging app android,0.34040420704159358
how long does verizon keep text messages,are text messages private,0.32746168685186161
is it illegal to read someones text messages on their phone,are text messages private,0.33485058126937345
text message privacy laws,are text messages private,0.31556732923014225
are text messages private property,are text messages private,0.33157736884012323
personal text message privacy laws,are text messages private,0.32204861601313522
private chat app for couples,secure messaging app iphone,0.33055600161396709
decrypt ciphertext without key,how to decrypt text,0.35007995514406931
how to decrypt encrypted files by cryptolocker,decrypt text file without key,0.31738486782642261
vigenere cipher solver without key,decrypt text without key,0.25295128542383893
autokey cipher decryption,decrypt text without key,0.25080352701470554
online cipher solver,decrypt text without key,0.28262892114251181
decrypt password in sql,how to decrypt a password,0.28220677924798998
decrypt facebook password,how to decrypt a password,0.28872743540612122
decrypt md5 password,how to decrypt a password,0.31029833189133732
rijndaelaescbc,aes decryption online,0.3100704809204517
aes calculator,aes decryption online,0.28500716374447915
tkip encryption,aes encryption,0.2361459284309651
autokey cipher solver without key,decrypt text online without key,0.32613316120864444
cti text encryption,text encryption software,0.33320737939669698
