delete facebook page,delete my facebook account right now,0.48371219768606671
facebook account login,delete my facebook account right now,0.44558651864839766
delete facebook account quora,how to delete facebook account permanently without waiting 14 days,0.51609125180403104
how to delete an old facebook account if i forgot the username and password,how to delete facebook account without password,0.51544749195685746
how can i delete my old facebook account if ive forgotten the password,how to delete facebook account without password,0.52242518801774851
delete facebook app android,how to delete fb account permanently from mobile,0.30412565712076606
how to delete facebook from iphone,how to delete fb account permanently from mobile,0.4309439213525536
how to deactivate facebook on iphone,how do i deactivate my facebook account,0.4778701775509141
how to deactivate facebook messenger,how do i deactivate my facebook account,0.42141956834855598
how to deactivate facebook on android,how to delete fb account on mobile,0.51381585437435795
how to delete a facebook page 2016,delete facebook page,0.52888469669200544
how to delete a facebook business page,delete facebook page,0.38842622514043074
facebookcompages i admin,delete facebook page,0.3177422447802476
how to delete a business page on facebook 2016,delete facebook page,0.4597145656337262
facebook logout,facebook account login,0.37736144827310153
facebook login account open,facebook account login,0.50157199752473014
facebook download,facebook account login,0.25854622811827904
facebook login welcome to facebook,facebook account login,0.39206029433332362
facebook sign up,facebook account login,0.34370936120546708
facebook mobile,facebook account login,0.35635792581608389
facebook app,facebook account login,0.38780587922870158
facebook search,facebook account login,0.25636466650843098
delete account instagram,delete my account,0.39378397658458547
delete account telegram,delete my account,0.26993375218963017
instagram delete account page,delete my account,0.48367856615431204
delete instagram account permanently link,delete my account,0.56479027071151344
how to delete instagram account on iphone,delete my account,0.46616250652164404
how to delete snapchat,delete my account,0.25217399729659851
forgot instagram password,delete my account,0.26819453404797233
how to open facebook account without password,how to delete facebook account without password video,0.52794501065213273
how to reactivate facebook,deactivate facebook what happens,0.56075222939057801
if i deactivate facebook can i still use messenger,deactivate facebook what happens,0.575471473911639
deactivate facebook messenger,deactivate facebook what happens,0.44203963774252719
how to deactivate facebook on samsung,how to deactivate facebook account in mobile,0.53956640673574718
how to reactivate facebook account that has been disabled,how to reactivate facebook account,0.45827078710696323
how to activate facebook account without phone number,how to reactivate facebook account,0.41091851028426657
how to react facebook,how to reactivate facebook account,0.20349538991109062
how to permanently delete instagram account,delete my fb account right now,0.53704038163472656
cant uninstall facebook app android,delete facebook app android,0.23577570918671162
uninstall facebook galaxy s6,delete facebook app android,0.20385100562015884
how to delete facebook app from iphone,delete facebook app android,0.40634470014029567
uninstall facebook from computer,delete facebook app android,0.42999822893249018
facebook uninstalled itself,delete facebook app android,0.34319052518506038
uninstall facebook galaxy s7,delete facebook app android,0.22319980928817479
how to deactivate facebook on iphone app,how to delete facebook from iphone,0.49934764677416543
what happens if i delete facebook app on iphone,how to delete facebook from iphone,0.50961485840106791
multiple facebook accounts on ipad,how to delete facebook from iphone,0.34243395853865921
how to logout of facebook on ipad,how to delete facebook from iphone,0.40832540029143133
how to deactivate facebook on iphone safari,how to deactivate facebook on iphone,0.46858005827710142
how to temporarily deactivate instagram,how to deactivate fb account temporarily,0.46752701252855966
how to tell if someone deleted their facebook account,what does a deactivated facebook account look like,0.46151012283431231
how to tell if someone deactivates their facebook account or blocked you,what does a deactivated facebook account look like,0.40531606384876717
facebook account deactivated or blocked,what does a deactivated facebook account look like,0.48918805503948792
if someone deactivates their facebook account can you still see their messages,what does a deactivated facebook account look like,0.5622612927838847
how to deactivate messenger on iphone,how to deactivate facebook messenger,0.38914765613043301
how to disable facebook messenger,how to deactivate facebook messenger,0.39252043763766736
how to delete facebook messenger account on android,how to deactivate facebook messenger,0.54763696955195507
how to get rid of facebook messenger,how to deactivate facebook messenger,0.4808136725591155
how to disable facebook messenger on android,how to deactivate facebook messenger,0.38802438427140984
how to remove account in messenger iphone,how to deactivate facebook messenger,0.57638697695271979
how to get rid of facebook messenger notification,how to deactivate facebook messenger,0.328959511326333
