how to encrypt phone calls,how to encrypt phone calls,1.0
encryption apps for android,how to encrypt phone calls,0.57894378944349567
encrypted cell phone communication,how to encrypt phone calls,0.65774492195557066
cell phone encryption software,how to encrypt phone calls,0.7807565667584756
encrypted phone calls iphone,how to encrypt phone calls,0.75810655694226525
encrypted phone for sale,how to encrypt phone calls,0.67714109137064538
best encrypted cell phone,how to encrypt phone calls,0.84162874285700751
cell phone encryption software android,how to encrypt phone calls,0.82792738763680718
android file encryption,encryption apps for android,0.49218397542374426
should i encrypt my android phone,encryption apps for android,0.67558096485916797
best android encryption app 2012,encryption apps for android,0.6676207939273523
decrypt sd card android,encryption apps for android,0.44705153450309354
android encryption app source code,encryption apps for android,0.51434502446926922
android phone encryption pros and cons,encryption apps for android,0.63596195094588392
how to decrypt android phone,encryption apps for android,0.65505690571951947
encrypted phone calls android,encrypted cell phone communication,0.78157396099514087
encrypted iphone,encrypted cell phone communication,0.41081812826214614
encrypt text messages android,encrypted cell phone communication,0.60845380754458789
encrypted mobile phones,cell phone encryption software,0.76217007184269492
best iphone encryption app,encrypted phone calls iphone,0.66435649282583376
iphone data encryption app,encrypted phone calls iphone,0.67954318596394281
iphone encryption software,encrypted phone calls iphone,0.56540568555044035
silent phone,encrypted phone for sale,0.40634645976756512
most secure cell phones,best encrypted cell phone,0.56392968289987577
best encryption app for android,best encrypted cell phone,0.65488740226826792
blackphone 2,best encrypted cell phone,0.40914469653815738
best encrypted messaging app,best encrypted cell phone,0.52312798253711235
encrypt phone calls,cell phone encryption software android,0.75871727248945842
how do i un encrypt my phone,cell phone encryption software android,0.58043714034414817
android encryption performance,cell phone encryption software android,0.45233380182409832
android encryption app,cell phone encryption software android,0.72499965859425386
android encrypt file example,android file encryption,0.4674637124062978
android file encryption app,android file encryption,0.60178587640230841
android encrypt file programmatically,android file encryption,0.48967230150414648
android file based encryption,android file encryption,0.50535505052082874
how to encrypt a folder in android programmatically,android file encryption,0.47972492380382575
android 7 file based encryption,android file encryption,0.43998157929726983
how to decrypt files on android,android file encryption,0.52867529998190899
android marshmallow encryption,should i encrypt my android phone,0.47495021396624459
how to encrypt your iphone,should i encrypt my android phone,0.44815159192982373
what does encrypt sd card mean,should i encrypt my android phone,0.45974160648333628
sd card encryption software,android encrypt sd card,0.53693508139757973
sd card encryption android apps,android encrypt sd card,0.64603719525572656
encrypt sd card windows 10,android encrypt sd card,0.44546049398392323
encrypt sd card mac,android encrypt sd card,0.4594992107017829
sd card encryption android,best android encryption app 2012,0.65156315696048361
sse encryption for windows,best android encryption app 2012,0.47350895850622604
decrypt sd card after factory reset,decrypt sd card android,0.45973103986955571
sd card decryption software,decrypt sd card android,0.59734630431041003
how to remove encryption from micro sd card,decrypt sd card android,0.53272458416036517
how to decrypt sd card in marshmallow,decrypt sd card android,0.53597019045614458
what does sd card encryption mean,decrypt sd card android,0.68884164142376814
recovering encrypted sd card after android factory reset,decrypt sd card android,0.49930631566441086
best android encryption app 2015,android encryption app source code,0.66646288689503586
android encryption source code,android encryption app source code,0.47144243767436278
encrypt android apk,android encryption app source code,0.51364973841702544
most secure messaging app 2016,android encryption app source code,0.48599141982940025
what happens if you encrypt your phone,android phone encryption pros and cons,0.66292356103837957
encrypt sd card,android phone encryption pros and cons,0.65805670057326404
how to decrypt samsung phone,how to decrypt android phone,0.58269489249344053
how to decrypt android marshmallow,how to decrypt android phone,0.50488618764448356
decrypt android lollipop,how to decrypt android phone,0.48961398185737542
how to disable encryption in android marshmallow,how to decrypt android phone,0.48760975221476421
accidentally encrypted my phone,how to decrypt android phone,0.60503953010886857
how to decrypt android photos,how to decrypt android phone,0.64171735532557361
iphone encryption app,encrypted iphone,0.634053612080828
encrypt iphone calls,encrypted iphone,0.63030759139606385
encrypt iphone messages,encrypted iphone,0.53907840094251946
turn off iphone encryption,encrypted iphone,0.43081479612595286
encrypted iphone for sale,encrypted iphone,0.45525670079050073
encrypted text messages iphone,encrypt text messages android,0.5241268582490618
how to read encrypted text,encrypt text messages android,0.43724655885807973
encrypted message app,encrypt text messages android,0.53074261470797512
encrypted message meaning,encrypt text messages android,0.43561066806433146
how to decrypt a message,encrypt text messages android,0.42752328591802075
encrypted phone calls,encrypted mobile phones,0.7004258309417829
best encryption app for iphone 6,best iphone encryption app,0.60150339373211348
ios file encryption app,best iphone encryption app,0.61790717108842008
how to encrypt iphone 5,iphone data encryption app,0.52390229444536163
how to encrypt iphone 6,iphone data encryption app,0.52971404079952611
