galaxy s6 bloatware to disable,uninstall facebook galaxy s6,0.31106792169670278
galaxy s6 apps to disable,uninstall facebook galaxy s6,0.3940269150405421
how to disable samsung pay,uninstall facebook galaxy s6,0.34245671337014627
free metal for facebook app,uninstall facebook galaxy s7,0.36812542663007358
package disabler pro,uninstall facebook galaxy s7,0.19792186778714371
facebook download for nokia,reinstall facebook app android,0.30995562243334657
facebook mobile,reinstall facebook app android,0.40903337587454025
mark zuckerberg,reinstall facebook app android,0.093673364598834422
messenger,reinstall facebook app android,0.30565130297004695
i want to delete my fb account permanently now,how to delete facebook account from phone,0.39325706832681268
how to delete fb account permanently and immediately,how to delete facebook account from phone,0.41079900598971686
multiple facebook accounts on ipad,how to delete facebook from iphone 6,0.38066475238811581
facebook this update is temporarily unavailable,reinstall facebook app on iphone,0.26746359798241448
reinstall facebook on blackberry,reinstall facebook on my phone,0.30129186196352514
messenger for desktop,how to uninstall facebook messenger on pc,0.31105454772765045
revo uninstaller pro,how to uninstall facebook messenger on pc,0.14771890854625361
facebook desktop,how to uninstall facebook messenger on pc,0.37250242271741668
how to uninstall apps on windows 10 store,uninstall facebook windows 10,0.3091190698112663
how to uninstall programs on windows 10 that wont uninstall,uninstall facebook windows 10,0.28273800303996383
windows 10 uninstall programs,uninstall facebook windows 10,0.2526943921235239
note 4 bloatware list,how to uninstall facebook on note 4,0.32838819410776793
note 4 bloatware list verizon,how to uninstall facebook on note 4,0.32914478037335143
remove bloatware note 4 without root,how to uninstall facebook on note 4,0.37583998721301531
