can network admin see my password,how to hide browsing history from network admin,0.30651927664865147
duckduckgo browser,non tracking web browser,0.24462284689294522
epic privacy browser,non tracking web browser,0.2633947623812507
ice dragon browser,non tracking web browser,0.17830125399595448
duckduckgo search engine,non tracking web browser,0.27832617286760752
anonymox chrome,how to browse anonymously chrome,0.22216391446297509
anonymox for chrome android,how to browse anonymously chrome,0.30454317941871611
anonymox firefox,how to browse anonymously chrome,0.27869338107762776
chromebook incognito mode,how to browse anonymously chrome,0.28320232548457253
anonymox premium code,how to browse anonymously chrome,0.19295919933648389
anonymox opera,how to browse anonymously chrome,0.28368280758296482
anonymox pengaya untuk firefox,how to browse anonymously chrome,0.22258469694551344
anonymous proxy servers,isp blocker free,0.28183620284095401
what can a network administrator see on a network,can network admin see my password,0.27421345366729399
can the administrator see deleted history,can network admin see my password,0.32248041430765045
will my isp tell my parents,can my internet provider see what i am doing,0.34887465445083021
wireless router log,can i ask my isp for internet history,0.22914417794647718
how to stop google from tracking your location,how to stop google from tracking my history,0.29879066465439791
duckduckgo vs google,duckduckgo browser,0.25994092169411737
duckduckgo review,duckduckgo browser,0.27605376377246721
gabriel weinberg entrepreneur,duckduckgo browser,0.089470639675181929
blekko,duckduckgo browser,0.16735138573064065
search engine duckduckgo firefox,duckduckgo browser,0.32737255164657086
duckduckgo android app,duckduckgo browser,0.31727258867380032
epic browser review,most secure internet browser,0.31875017102670328
secure browser safer technologies,most secure internet browser,0.33033568064913899
comodo dragonice dragon,epic privacy browser,0.15636370843313246
aviator browser,most private browser,0.25868705536957776
comodo icedragon review,ice dragon browser,0.23090936268310819
ice dragon dragon city,ice dragon browser,0.058583074575353535
ice dragon game of thrones,ice dragon browser,0.087482091047548144
comodo icedragon update,ice dragon browser,0.22535072780860824
ice dragon pokemon,ice dragon browser,0.08593443054797506
ice dragon urban dictionary,ice dragon browser,0.13663553466727352
comodo icedragon portable,ice dragon browser,0.22243663699959018
ice dragon jon snow,ice dragon browser,0.11616717069472343
duckduckgo app,duckduckgo search engine,0.35862320905876244
