most secure internet browser,non tracking web browser,0.32659382030219797
duckduckgo browser,non tracking web browser,0.32327820627904197
epic privacy browser,non tracking web browser,0.26578649647558783
ice dragon browser,non tracking web browser,0.17818995001253091
can network admin see my password,how to hide browsing history from network admin,0.25378594811744171
anonymox chrome,how to browse anonymously chrome,0.22604020373002828
anonymox for chrome android,how to browse anonymously chrome,0.29671573691630398
anonymox firefox,how to browse anonymously chrome,0.26553943302284233
chromebook incognito mode,how to browse anonymously chrome,0.27548221288334324
anonymox premium code,how to browse anonymously chrome,0.17009647384080329
anonymox opera,how to browse anonymously chrome,0.29006328592629638
anonymox pengaya untuk firefox,how to browse anonymously chrome,0.20442555435292409
hide my ip address free download full version,isp blocker free,0.382788818293607
anonymous proxy servers,isp blocker free,0.28054305660867501
how to turn off location on google chrome,how to stop google from tracking your location,0.38526427265393248
turn off google location services,how to stop google from tracking your location,0.2963440495168353
turn off google location detection,how to stop google from tracking your location,0.38121376174373411
android turn off location services programmatically,how to stop google from tracking your location,0.27731548507558113
how to turn off frequent locations on iphone,how to stop google from tracking your location,0.28073626365489235
how to turn off frequent locations on samsung,how to stop google from tracking your location,0.34496013844136292
does google report illegal searches,does google report your searches,0.34943867507246995
what google searches are illegal,does google report your searches,0.37024679804051086
advertising cookie optout page,stop google from tracking your searches popup,0.22889773389674373
google tracking,stop google from tracking your searches popup,0.35125108863079413
google advertisement settings,how to stop google from tracking you on the web,0.35826463126907926
advertising cookie opt out google,how to stop google from tracking you on the web,0.31008357725070973
secure browser safer technologies,most secure internet browser,0.32832705612738644
duckduckgo vs google,duckduckgo browser,0.27034736002529702
duckduckgo review,duckduckgo browser,0.26448959663640947
gabriel weinberg entrepreneur,duckduckgo browser,0.083727002475637663
blekko,duckduckgo browser,0.17139495236253816
search engine duckduckgo firefox,duckduckgo browser,0.3165452484303326
ixquick,duckduckgo browser,0.21511461183402047
duckduckgo android app,duckduckgo browser,0.31703821488152445
search engine definition,duckduckgo browser,0.24925049493292548
epic privacy browser for android,epic privacy browser,0.36033228019567193
epic privacy browser review,epic privacy browser,0.38867282173224194
epic browser for windows 10,epic privacy browser,0.35319117534233363
comodo dragonice dragon,epic privacy browser,0.13949631820271244
indian browsers list,epic privacy browser,0.39009827647038975
epic privacy browser portable,epic privacy browser,0.3738634454792113
aviator browser,most private browser,0.23781895157794114
comodo icedragon review,ice dragon browser,0.22434621052497791
