hack someones gmail account,google hangout spy,0.31221978518437771
1topspy,how to hack someones hangouts,0.27097985308991768
how to hack gmail account without password,hack someones gmail account,0.29209462476447084
how to hack a yahoo email,hack someones gmail account,0.28336880398603048
chat app for kids,google hangouts parental controls,0.31186363165377912
hangout film rating,is google hangouts safe for kids,0.19307262289899121
minimum age to join youtube,google hangouts age limit,0.21718576619973048
hotmail age requirement,google hangouts age limit,0.24834118406519767
yahoo mail age requirement,google hangouts age limit,0.30191588047761353
can my employer read my personal email,can it read my gmail at work,0.25136699011015334
personal email at work monitoring,can it read my gmail at work,0.30422445328357045
using personal email for work purposes,can it read my gmail at work,0.31459525069178795
does skype use end to end encryption,google hangouts end to end encryption,0.27527190822096098
duo encryption,google hangouts end to end encryption,0.31891599399237242
go off the record meaning,gchat off the record,0.23712916006396778
google location sharing not working,google hangouts location sharing,0.31381128714900225
how to send location android,google hangouts location sharing,0.26611102771532746
share location whatsapp,google hangouts location sharing,0.24902692904585869
find friend location by mobile number,google hangouts location sharing,0.26105561030085589
hangoutsjson reader,hangout chat history download,0.23875198611575535
