remove facebook contacts from outlook,remove social media connection twitter,0.30912881680437171
how to remove facebook birthdays from outlook calendar,remove social media connection twitter,0.44025039554923662
the selected items cannot be deleted from your contacts,remove facebook contacts from outlook,0.37917412502944231
hotmail facebook sign in,how to unlink facebook from hotmail,0.32576174810278102
disable outlook social connector 2016,remove linkedin contacts from outlook 2013,0.36018927243744187
what is outlook social connector 2016,remove linkedin contacts from outlook 2013,0.37568228753814675
disable outlook social connector group policy,remove linkedin contacts from outlook 2013,0.37092539326630697
remove facebook birthdays from windows 10 calendar,how to remove facebook birthdays from outlook calendar,0.41447311366134287
some items cannot be deleted outlook 2013,the selected items cannot be deleted from your contacts,0.36551107840843361
some items cannot be copied they were either moved or deleted or access was denied,the selected items cannot be deleted from your contacts,0.25081804937408347
some items cannot be deleted outlook 2016,the selected items cannot be deleted from your contacts,0.41080996324796099
the item cannot be moved it was either already moved or deleted or access was denied exchange 2010,the selected items cannot be deleted from your contacts,0.3342607295031626
some items cannot be deleted outlook 2010 public folder,the selected items cannot be deleted from your contacts,0.37076844489743332
outlook 2010 some items cannot be copied they were either moved or deleted or access was denied,the selected items cannot be deleted from your contacts,0.44090049294948302
how to delete microsoft account in windows 10,remove facebook from microsoft account,0.41028499315237438
combine microsoft accounts,remove facebook from microsoft account,0.41442516468277424
windows live contacts,import facebook contacts to hotmail,0.37035571921897326
outlook csv format,import facebook contacts to hotmail,0.33591334013511692
iphone only show contacts with phone numbers,remove twitter contacts from iphone,0.43807176642952417
unlink facebook account from instagram,how to unlink facebook from gmail,0.38380176012314043
how to stop facebook notifications on gmail,how to unlink facebook from gmail,0.31054488207532532
how to delete facebook account permanently gmail,how to unlink facebook from gmail,0.41508896422993047
i have two facebook accounts how do i separate them,how to unlink two facebook accounts,0.41142447357832884
create account hotmail now,hotmail facebook account,0.37235495123648149
hotmail facebook login,hotmail facebook account,0.37998203547102682
https wwwfacebookcom hotmail sign in,hotmail facebook account,0.27707811143915506
create hotmail id,hotmail facebook account,0.42634680950290688
create hotmail account without phone number,hotmail facebook account,0.38630092139399413
create an email account,hotmail facebook account,0.35189448819319347
facebook logout,hotmail facebook sign in,0.3289340356324218
facebook app,hotmail facebook sign in,0.41415244057353734
facebook download,hotmail facebook sign in,0.28185091664502382
facebook sign up,hotmail facebook sign in,0.38300020522428047
facebook lite,hotmail facebook sign in,0.22483153542561823
facebook login mobile,hotmail facebook sign in,0.33913882393511902
facebook linked pages,linked accounts on facebook,0.37250968887096586
how to link facebook to instagram,linked accounts on facebook,0.34481044676999661
linked accounts instagram,linked accounts on facebook,0.36331588700026018
remove outlook connector from outlook 2007,disable outlook social connector 2016,0.4325438047756911
outlook social connector 2016 download,disable outlook social connector 2016,0.3863608848322983
outlook social connector linkedin,what is outlook social connector 2016,0.38979966513831049
outlook social connector download,what is outlook social connector 2016,0.39487945000921848
outlook social connector 2010,what is outlook social connector 2016,0.42013981377280729
outlook social connector 64 bit,what is outlook social connector 2016,0.3923782725559769
microsoft sharepoint server colleague import addin,outlook social connector 2013 add in,0.2478371862743998
outlook social connector download 64 bit,outlook social connector not working,0.4320756141309236
xobni,outlook social connector not working,0.17440777464397142
windows 10 birthday notifications,windows 10 calendar birthdays,0.17555648059869056
windows 10 calendar app,windows 10 calendar birthdays,0.37203148395559898
