delete your snapchat account,0.87077366630461184
what happens when you delete snapchat account,0.86294707827982364
delete snapchat chat account,0.88903073495447993
snapchat support delete account,0.80802225256285198
how to deactivate snapchat,0.93264043933259855
if i delete my snapchat will it delete sent snaps,0.64174631592828701
snapchat com delete account,0.90733145834013618
how to deactivate snapchat 2016,0.85753879662483012
snapchatcom delete account,0.78609749689996566
how to deactivate snapchat android,0.87550718586307075
how to delete snapchat account on iphone,0.86492917897361887
how to delete snapchat,0.67875132911935465
how to delete snapchat account android,0.80875697055062423
