how to hide facebook data,0.7011905160470473
how to hide facebook info,0.7062459695049419
Hide Facebook from government,0.63724841846744429
How to block the government from accessing my Facebook.,0.63482877110992841
how to hide facebook data from government,0.65607568204328137
facebook data privacy government,0.59094321718132103
how to hide my information on facebook,0.72738440772784729
Facebook government privacy,0.66586158699360942
Facebook profile government secrecy options,0.59127737974945394
How would I use Privacy Settings in Facebook to make sure my data is safe from the government?,0.67828445153165973
Can the government see private information on Facebook?,0.65334973389481255
how to hide facebook from government,0.74820404975173771
hiding data fb government,0.63785999697642792
Block Facebook account from US Government,0.6140044075078096
Facebook Privacy settings,0.63333570237191583
