Does PokémonGo share private information,0.48851439808301256
Hiding pokemon go from government,0.74485579247524314
hide PokemonGo data from government,0.73922391054923886
pokemongo data security,0.59191111645114547
how do i hide pokemon data,0.70822641183810653
pokemon go settings,0.48879831557197784
hide pokemongo data government,0.80346571908967979
Hidding PolemonGo data from the goverment,0.81390701281646882
how to keep pokemongo data private,0.76784710205794016
hide pokemonGo data,0.75343534976407878
PokemonGo information keep private,0.71583302125426007
Hide my personal information from PokemonGo,0.73176242335927288
Keep government from reading pokemon data,0.68133920953811111
securing my PokemonGo data,0.74942286447503748
hide data pokemongo,0.71536395534571695
pokemon go data,0.70530070769738185
hide data government pokemongo,0.82686927966656076
How to hide my PokemonGo data from the gorvermet,0.85667143296603687
hide pokemongo data,0.78812954463802332
hide pokemongo for government,0.73783134635923164
PokemonGo keep from government,0.69743905061530109
What personal information does PokemonGo collect,0.59223757174754021
Hide my pokemon data from spying.,0.64069737709926655
can the government see my PokemonGo data,0.85457009208302237
secure pokemongo data,0.7034364598375189
how to hide data from the goverment,0.42113865370153702
pokemon go government watching,0.68562081075584214
pokemongo hide data government,0.84203300221208777
I want ti hide my PokemonGo data from the goverment.,0.79718402914151609
keep pokemongo info private,0.71201017393037813
protect pokemongo data from the being seen,0.70308096359164063
keep PokemonGo data from government surveillance,0.65467825006571023
