delete PokemonGo,0.93077794885914544
how can I delete pokemonGO,0.97404726322587754
How do I delete my pokemongo account,0.79075645112696291
How do I get pokemon go off of my iphone,0.60857929056038418
How to uninstall Pokemon Go android,0.74024240897893623
How to uninstall pokemongo,0.85438593479122238
Remove Pokemon Go,0.71678828667943884
get rid of PokemonGo,0.6702287431462286
How do I uninstall pokemonGO,0.93291665410899138
Disable Pokemon go,0.56847720757846232
How do I delete pokemon go,0.93865411137064836
Pokemon go app uninstall,0.80384415968017608
How to delete pokemongo,0.9338373049616403
Delete Pokemon from my phone,0.80925820653681479
uninstall PokemonGo,0.85123683120586136
how do i remove pokemonGo from my phone,0.81215993966648026
Delete pokemongo,0.8949972177326545
What do I do to get pokemon go off of my phone,0.66247467134338778
delete Pokemon go,0.90158698344023203
how to uninstall delete pokemongo,0.91828832584075759
How can i uninstall Pokeman from my Android,0.74004999828173657
