delete your snapchat account,0.87271730408232173
what happens when you delete snapchat account,0.85450774186568912
delete snapchat chat account,0.89033653766339182
snapchat support delete account,0.81029367524521057
how to deactivate snapchat,0.9347109225937329
if i delete my snapchat will it delete sent snaps,0.63798642408593942
snapchat com delete account,0.90914941226889212
how to deactivate snapchat 2016,0.86854617113294941
snapchatcom delete account,0.79151788515301502
how to deactivate snapchat android,0.87391704539250004
how to delete snapchat account on iphone,0.86035578478415364
how to delete snapchat,0.69071000732787569
how to delete snapchat account android,0.79557264519843063
