how to delete a snapchat account,how to delete a snapchat account,1.0
how to delete snapchat account android,how to delete a snapchat account,0.89908580153733075
how to delete a snapchat message,how to delete a snapchat account,0.74507835948658518
how to delete snapchat account on iphone,how to delete snapchat account android,0.82066686705873415
what happens when you delete snapchat account,how to delete snapchat account android,0.85005214376282046
how to delete a snapchat message before someone sees it,how to delete a snapchat message,0.77512673707794344
how to delete a message on snapchat before they see it,how to delete a snapchat message,0.75165463809764488
if you clear a conversation on snapchat can the other person still see it,how to delete a snapchat message,0.70389467759445634
delete snapchat chat account,how to delete a snapchat message,0.85856890940051489
how to delete snapchat message,what happens when you delete snapchat account,0.80097962271452861
how to delete a snapchat story,what happens when you delete snapchat account,0.71980836410712346
