how to unfriend someone on snapchat,how to unfriend someone on snapchat,1.0
how to unfollow someone on snapchat,how to unfriend someone on snapchat,0.7314256761112109
if you delete someone on snapchat can they see your story,how to unfriend someone on snapchat,0.75791296656094553
how do i know if someone deleted me on snapchat,how to unfriend someone on snapchat,0.80588372069602909
if i delete someone on snapchat am i still on their list,how to unfriend someone on snapchat,0.85980383098153723
when you delete someone off snapchat do they appear on your added me list,how to unfriend someone on snapchat,0.85776487375734523
what does added you back mean on snapchat,how to unfriend someone on snapchat,0.70843901846983781
if you unfollow someone on snapchat can they still see your snaps,how to unfollow someone on snapchat,0.81022771242451097
if i unfollow someone on snapchat can they still see my snaps,how to unfollow someone on snapchat,0.85405198476210586
how to unfollow on snapchat but still be friends,how to unfollow someone on snapchat,0.81749110504800748
how to unfriend someone on snapchat without them knowing,how to unfollow someone on snapchat,0.7430088352069929
how to unfollow someone on snapchat 2016,how to unfollow someone on snapchat,0.7780465102845151
if you delete someone on snapchat will they know,if you delete someone on snapchat can they see your story,0.87571573532521663
if you delete someone on snapchat are you still on their list,if you delete someone on snapchat can they see your story,0.87615496399824233
if you delete a snapchat story can anyone see it,if you delete someone on snapchat can they see your story,0.77225055016287603
how to know if youve been blocked on snapchat,how do i know if someone deleted me on snapchat,0.71545696939226444
how to tell if someone blocked you on snapchat story,how do i know if someone deleted me on snapchat,0.78191745793508904
what happens when you delete someone on snapchat,how do i know if someone deleted me on snapchat,0.84256708148945403
if i delete someone on snapchat can they still see my story,if i delete someone on snapchat am i still on their list,0.85100698165615951
how do you know if someone deleted their snapchat app,if i delete someone on snapchat am i still on their list,0.80228197455719108
if you delete someone on snapchat can you add them back,when you delete someone off snapchat do they appear on your added me list,0.88758770914995244
someone deleted me on snapchat but it says they added me back,when you delete someone off snapchat do they appear on your added me list,0.82540868996378836
added you back snapchat after deleting,what does added you back mean on snapchat,0.85169076116724685
snapchat added you back after blocking,what does added you back mean on snapchat,0.85694689553670711
added you back snapchat blocked,what does added you back mean on snapchat,0.85640049677326313
added you back on snapchat after deleting them,what does added you back mean on snapchat,0.87648530770811683
if you unfriend someone on snapchat can they see your story,if you unfollow someone on snapchat can they still see your snaps,0.79311600883708477
if you delete someone on snapchat can they still see your story,how to unfollow on snapchat but still be friends,0.85180098307986418
remove friend snapchat,how to unfollow on snapchat but still be friends,0.76959660929083695
howdo i knowif someone deletedmeon snapchat,how to unfollow on snapchat but still be friends,0.88490077262860822
if i delete a snapchat story before anyone sees it,if you delete a snapchat story can anyone see it,0.71178479168866282
can my friends still see a snapchat story i deleted,if you delete a snapchat story can anyone see it,0.81613453930850499
snapchat blocked me,how to know if youve been blocked on snapchat,0.74934835567622771
if you block someone on snapchat can they see your snaps,how to tell if someone blocked you on snapchat story,0.87288842683328394
if i block someone on snapchat can i still see their story,how to tell if someone blocked you on snapchat story,0.80802867121802902
how to know if someone deleted their snapchat,how to tell if someone blocked you on snapchat story,0.8754395235555319
if you re add someone on snapchat will they know,if you delete someone on snapchat can you add them back,0.86431658394332733
someone added me on snapchat but i cant add them back,someone deleted me on snapchat but it says they added me back,0.84243187371446138
added me back snapchat,someone deleted me on snapchat but it says they added me back,0.75295822346783314
someone added me on snapchat but i cant add them,snapchat added you back after blocking,0.84681842705323185
when you remove a friend from snapchat what happens,snapchat added you back after blocking,0.79298671832621792
