how to unfollow someone on twitter,how to unfollow someone on twitter,1.0
how to unfollow on twitter fast,how to unfollow someone on twitter,0.81170100903514597
unfollow twitter who dont follow you,how to unfollow someone on twitter,0.81092743193606842
mass unfollow twitter,how to unfollow someone on twitter,0.76060150490773293
unfollow all twitter,how to unfollow on twitter fast,0.85431299732711607
not following back twitter,how to unfollow on twitter fast,0.78695245862005103
unfollow non followers on instagram,how to unfollow on twitter fast,0.74278050789011796
twitter unfollow all,unfollow twitter who dont follow you,0.86264510661261451
