how to change facebook privacy settings,how to change facebook privacy settings,1.0
facebook friends list privacy,how to edit friends list on facebook mobile,0.36357329181178405
privacy options computer definition,what are privacy settings,0.32724041385890906
facebook privacy hoax 2016 snopes,facebook legal disclaimer hoax,0.41920858475303696
what does my facebook look like to someone im not friends with,how can i see what my profile looks like to other people,0.64808457183714896
facebook tagged photos privacy,who can see photos im tagged in on facebook,0.57532128458873233
verisign class 3 public primary certification authority  g5 not trusted,verisign certificate download,0.54957415931940901
what does my facebook look like to non friends on mobile,can non friends see facebook timeline,0.65976735473674275
how to delete feeds on facebook,how to delete smart lists on facebook,0.41809855422432962
mobile photo uploads,how to change privacy settings for mobile uploads,0.31506014391498588
what is mobile uploads in facebook,how to change privacy settings for mobile uploads,0.44914279506532351
fb friends privacy settings,facebook privacy settings friends list,0.80382015345529556
custom audience facebook mobile,how to edit custom audience on facebook,0.40833106891589493
where is the audience selector for photo albums on facebook,audience selector tool not working facebook,0.54453851343424398
how to delete friends list on facebook app,how to remove custom list facebook,0.66116927542012138
how to block someone from seeing your tagged photos on facebook,how to block someone from seeing your pictures on facebook,0.7196533782057779
how to change privacy settings on facebook photos of me,facebook privacy settings photos,0.84672960976681699
how to hide photos on facebook from public,how to hide photos of you on facebook from friends,0.47523943529980961
comodo seal,verisign seal,0.51125826050622614
facebook custom privacy,custom list facebook who can see,0.66272113196534332
facebook mobile uploads hack,how to change privacy settings for mobile uploads,0.44089821196530699
ucc 1103 explanation,ucc 1 103 1 308 explained,0.30416276275937743
can friends of friends see my posts on facebook,who can see what others post on your timeline,0.66567628593038997
top 9 friends on facebook,who shows up on my facebook friends list,0.58824601678041333
how to view private mobile uploads on facebook 2015,how to change privacy settings for mobile uploads,0.47062980789154235
facebook photos of you not showing,how to make tagged photos private on facebook,0.75144928136869393
snopes facebook privacy 2016,is the facebook privacy post real,0.33465269809215831
who can see photos im tagged in on facebook,how to control who sees your photos on facebook,0.43648521722417322
facebook account settings username,facebook settings page,0.431043303357868
personal privacy,privacy options definition,0.4429016985466856
edit smart list facebook,how to delete smart lists on facebook,0.45081981546212391
channel 13 news facebook hoax,facebook privacy changes july 2016,0.42623915051968175
how to change friend settings on facebook mobile,facebook privacy settings friends list,0.85858541798633625
privacy settings meaning,what are privacy settings,0.6618157183445843
verisign trust seal,verisign seal,0.43838016344851227
how to change the audience for cover photos on facebook,you can change the audience for each photo in this album,0.50219589711399759
create friend list facebook iphone,how to edit friends list on facebook android,0.64098845792893655
facebook privacy policy change 2016,facebook privacy changes july 2016,0.53554097222872021
personal privacy issues,personal privacy,0.51778979204213926
how to hide all tagged photos on facebook,how to hide photos of you on facebook from friends,0.60040159175241004
what are privacy settings,how to change facebook privacy settings,0.73640198101628207
who can see my friends list on facebook setting,only me can see my friends list,0.7426994655650565
how to hide friends on facebook mobile,how to hide friends on facebook from other friends,0.69645270818478633
facebook page privacy and visibility settings,facebook page album privacy,0.62690084727307926
facebook privacy settings photos,how to change facebook privacy settings,0.8070339546268126
wwwfacebookcom download now,facebook download,0.3138767862542029
how to change album privacy on facebook android,facebook privacy settings photos,0.82095945986425545
facebook download mobile,facebook app,0.45770990221631164
how to hide friends list on facebook android app,how to change friend list privacy on facebook app,0.65798734639122203
computer privacy issues,privacy options computer definition,0.42786363420949391
facebook privacy changes october 2016,facebook new privacy settings 2016,0.60380783239956604
no friends to show in facebook,only me can see my friends on facebook,0.76735102428662427
how do i know if im restricted on facebook,facebook edit friends list restricted,0.42973587953199877
fb logout button,facebook logout,0.37079955025605721
reset facebook settings,facebook settings page,0.44232204227860333
facebook home page,http wwwfacebookcom full site,0.3876278720172403
how do i stop people who are not my friends from seeing anything on my profile,can non friends see facebook timeline,0.71090302214089107
how to hide your tagged photos on instagram,how to hide tagged photos on facebook from everyone,0.42055440128058175
what does my facebook look like to non friends 2015,can non friends see facebook timeline,0.69691865195426173
how do i block the public from seeing my pictures on facebook,how to block someone from seeing tagged posts on facebook,0.7887563121560075
what does privacy settings mean,privacy settings meaning,0.63929108259336054
facebook privacy hoax october 2016,facebook legal disclaimer hoax,0.37884828177722879
facebook search login,facebook search,0.50663600404557918
snopes facebook 2016,deadline tomorrow facebook snopes,0.32570446715676654
internet privacy definition,privacy options computer definition,0.55164282654362073
facebook app download for samsung,facebook app,0.4533903874120207
is there a real way to see who views your profile on facebook,how can i see who views my facebook profile for free,0.54667718822766354
how to hide photos on facebook from friends,how to hide photos of you on facebook from public,0.64239268383763859
how do i make my facebook photos private to non friends,how to make your facebook albums private,0.70933248985700192
facebook profile picture privacy settings,who can see my facebook profile picture,0.66949754840001152
audience selector facebook mobile,you can change the audience for each photo in this album,0.4864301921594037
how to rearrange photos in facebook album on ipad,how to edit album privacy on facebook using ipad,0.4602633507863223
facebook friends list privacy mobile,facebook privacy settings friends list,0.56286813317964668
definition of privacy options,privacy settings meaning,0.64076778517040855
facebook app java,facebook app,0.39397363752373488
how to make tagged photos private on instagram,how to make tagged photos private on facebook,0.59447070820642178
change order of photos in facebook album on ipad,how to edit album privacy on facebook using ipad,0.4386502671400952
who can see my friends list on facebook settings,only me can see my friends on facebook,0.7453247363804103
personal privacy online,personal privacy,0.50845340363001201
install facebook,facebook download,0.38531166800100913
facebook app for iphone,facebook app,0.34718351094809941
how to make mobile uploads private on facebook 2016,how to make albums private on facebook mobile,0.62460873987532628
facebook public entity october 2016,facebook legal disclaimer hoax,0.35518096105437535
are facebook lists private,facebook custom list visibility,0.63162778303960476
how to change the audience for a whole album on facebook,audience selector tool not working facebook,0.59530068441519168
how to block a friend from seeing pictures on facebook,how to hide pictures on facebook from certain friends,0.76182201500191804
how to make tagged photos private on facebook,how to hide photos of you on facebook,0.59734050870403987
facebook hoaxes snopes,facebook hoax meme,0.35108279325978486
how to get rid of a list on facebook,how to delete smart lists on facebook,0.50877001445500891
deadline tomorrow facebook snopes,facebook privacy changes 2016 hoax,0.33766474151440506
hide tagged photos from certain friends,how to hide pictures on facebook from certain friends,0.70186191956253119
how to control who sees your photos on facebook,facebook privacy settings photos,0.73690090403430608
truste badge,verisign seal,0.55883203931512515
how to change audience on facebook ad,how to edit custom audience on facebook,0.39163495436107065
how to limit audience for cover photos on facebook,how to change the audience for cover photos on facebook,0.63172595365258577
how to not show my friends on facebook,only me can see my friends on facebook,0.79522630782824943
personal privacy rights,personal privacy,0.42416303971977742
internet privacy issues 2015,computer privacy issues,0.52628150768764603
change in facebook privacy policy channel 13,facebook privacy change 2016,0.34457614201489245
facebook sign up new person,facebook sign up,0.43405155376141197
how to hide friends on facebook iphone,facebook friends list privacy mobile,0.583505368887968
facebook search,http wwwfacebookcom full site,0.33256275561257198
how to remove custom list facebook,custom privacy on facebook,0.53642779365770887
what is the facebook privacy hoax,facebook privacy settings 2016,0.55593766037489034
facebook search by email,facebook search,0.42356535074914359
no one can see my friends list on facebook,facebook friend list privacy only me,0.74569330609382101
what are some webrelated privacy issues,computer privacy issues,0.40868898602648318
is facebook making all posts public,how to change audience on facebook timeline,0.49956215020759487
where is my profile on facebook,how can i see what my profile looks like to other people,0.75302400524936874
privacy rights,personal privacy,0.38554905959559355
verisign class 3 secure server ca  g3,verisign certificate download,0.53366315827992794
privacy options,what does privacy settings mean,0.47429677092751599
facebook privacy changes 2016,facebook privacy changes hoax,0.59309150939238875
nasdaqvrsn,verisign linkedin,0.35297670776636808
are facebook custom lists private,facebook custom list visibility,0.58440808312701187
who can see my timeline on facebook,how to change audience on facebook timeline,0.54829046471665321
custom friends list facebook app,how to create custom list on facebook,0.73008664443550486
facebook search friends by phone number,facebook search,0.39433044429408826
google account sign in,privacy settings google,0.36671761492176635
who can see what others post on your timeline,who can see my photos on facebook timeline,0.50208282104635138
what is privacy,personal privacy,0.61910894928836591
how to hide photos on facebook,how to hide friend list on facebook from public,0.70522829875465287
facebook view tracker,who can see my profile on facebook,0.44666689607665427
facebook app,http wwwfacebookcom full site,0.36928598547452801
internet privacy essay,internet privacy definition,0.32829899864991141
how to edit friends list on facebook iphone app,how to edit custom list on facebook,0.5440640579305307
facebook privacy change hoax 2016,facebook privacy changes hoax,0.51187688923804575
personal privacy definition,privacy options definition,0.53921574500557623
internet memes 2016,internet meme definition,0.31526918615116811
how others see my facebook mobile,how can i see what my profile looks like to other people,0.74159528267838937
how to hide a tagged post from someone on facebook,how to hide tagged photos on facebook from certain friends,0.65528105659595304
how to hide tagged photos on facebook,how to hide photos of you on facebook from public,0.48237130063989286
who can see what i post on a friends timeline,who can see what others post on your timeline,0.60463047047993845
why is online privacy important,computer privacy definition,0.41372780874276771
how to make tagged photos private on facebook 2016,how to make tagged photos private on facebook,0.77287923782261625
how to see what your facebook profile looks like to others on mobile,how can i see what my profile looks like to other people,0.70455293247433426
how to edit custom list on facebook mobile,how to edit friends list on facebook android,0.723110476831344
you can change the audience for each photo in this album,facebook privacy settings photos,0.70777933595004094
how to change friend list privacy on facebook app,facebook privacy settings friends list,0.82247594881133423
facebook privacy change snopes,facebook policy change 2016,0.38313134473502819
how to edit custom list on facebook,custom privacy on facebook,0.56304289202823099
facebook privacy settings friends list,how to change facebook privacy settings,0.78193160645761783
how to edit custom audience on facebook,custom privacy on facebook,0.32781163503145866
facebook login 2,facebook logout,0.33394264490782871
snopes facebook see who viewed your profile,facebook privacy snopes,0.46363172002737929
how to change privacy setting of album on facebook mobile,facebook privacy settings photos,0.67424177005691821
facebook specific friends privacy,custom list facebook who can see,0.72143468534679767
facebook privacy changes 2016 hoax,facebook privacy settings 2016,0.52493567320203971
how to change audience on facebook photo albums,audience selector tool not working facebook,0.57693950533299743
how to hide tagged photos on facebook from certain friends,facebook privacy settings photos,0.59417136382462521
facebook acquaintance list,facebook edit friends list restricted,0.411354467260787
how to hide photos on facebook mobile,how to hide photos of you on facebook from public,0.72439269838103404
facebook custom list mobile,how to edit friends list on facebook android,0.58782048360757588
facebook download,http wwwfacebookcom full site,0.32852892909676085
how do you make your tagged photos private on facebook,how to hide tagged photos on facebook from certain friends,0.64137102047101091
can restricted friends see my likes,facebook edit friends list restricted,0.48283822066300747
how to hide friend list on facebook android,how to edit friends list privacy on facebook mobile,0.63524370478892067
how to delete friends list on facebook,how to edit friends list on facebook mobile,0.32997801611247485
how to change share settings on facebook,how to change audience on facebook timeline,0.59195781203096931
how do i create a friends list on facebook mobile,how to edit friends list on facebook android,0.67148786546743211
how to block someone from seeing tagged photos on facebook,how to hide a tagged post from someone on facebook,0.7329549959063798
facebook page settings no comments,facebook page album privacy,0.51544167206854008
how can i hide my friend list on facebook in mobile,only me can see my friends on facebook,0.71488361391006638
facebook logout button missing,facebook logout,0.34958170879409822
how to delete friends list on facebook mobile,how to remove custom list facebook,0.62827921769048523
how to hide photos youre tagged in on facebook,how to hide photos of you on facebook,0.54211701431117043
symantec class 3 secure server ca  g4 root certificate download,verisign certificate download,0.38888985121254732
how to edit audience on facebook,how to edit custom audience on facebook,0.41176080552473693
how to view facebook photo albums on ipad,how to edit album privacy on facebook using ipad,0.50943794615171234
why cant i see my friends profile picture on facebook,who can see my facebook profile picture,0.80194880054316486
how to hide friends list in facebook,facebook friends list privacy mobile,0.5774073348069545
can you hide a picture from someone on instagram,how to hide pictures on facebook from certain friends,0.4857731109576584
everything on facebook becoming public,facebook privacy settings 2016,0.38921843419848839
privacy meaning in english,privacy meaning,0.47840949568246521
facebook logout url,facebook logout,0.34516594257099181
how to hide tagged photos on facebook from everyone,how to hide tagged photos on facebook from certain friends,0.58805928053453249
how does facebook decide which friends to show on profile page,who shows up on my facebook friends list,0.66455075660409091
facebook privacy settings explained,how to change facebook privacy settings,0.7487763529563024
how to hide friends on facebook 2016,how to hide friends list in facebook,0.6454117919478537
old facebook sign in,facebook sign up,0.41747482404006525
privacy definition computer,privacy meaning,0.57306461500431738
facebook logout,http wwwfacebookcom full site,0.30635840458341734
audience selector tool not working facebook,how to change privacy setting of album on facebook mobile,0.39015475918020021
how to edit album privacy on facebook using ipad,how to change privacy setting of album on facebook mobile,0.51110493168176618
how to make mobile uploads private on facebook 2015,how to change privacy settings for mobile uploads,0.39070520783462442
verisign certificate authority,verisign certificate download,0.66242532963198564
is the facebook privacy post real,facebook privacy change 2016,0.45108796351338548
online privacy issues,computer privacy issues,0.46083877682913355
facebook privacy settings guide,how to change facebook privacy settings,0.70661212673545215
how to block public from seeing facebook profile,can non friends see facebook timeline,0.73350543522442369
how to hide photos youre tagged in on instagram,how to hide old tagged photos on facebook,0.40857459054907791
you can change the audience for each photo in this album not working,audience selector tool not working facebook,0.58263219843524361
my account google,privacy settings google,0.43862687935539557
who viewed my facebook profile app for android,how can i see who views my facebook profile for free,0.50757428577156083
how to view photos of non friends on facebook,can non friends see facebook timeline,0.77012735322579684
facebook policy change 2016,facebook privacy change 2016,0.49600453254660187
facebook hoax meme,what is the facebook privacy hoax,0.31608785965970965
privacy settings facebook,facebook privacy settings guide,0.8445887329158609
computer privacy articles,what is computer privacy,0.36591784150595613
facebook limit old posts to only me,how to change audience on facebook timeline,0.51284531224738705
facebook custom list settings,custom privacy on facebook,0.69340242253124107
facebook privacy changes june 2016,facebook privacy settings 2016,0.5444792086256709
who can see my photos on facebook timeline,facebook privacy settings photos,0.72569407351945514
facebook privacy changes hoax,facebook privacy settings 2016,0.39252532171186777
verisign intermediate certificate download,verisign certificate download,0.51506759771548793
who shows up on my facebook friends list,facebook friend list privacy only me,0.65969295258986993
change facebook settings,facebook settings page,0.72645161073851883
internet privacy issues,computer privacy definition,0.33124690019570191
facebook setting privacy,facebook settings page,0.57885554235516001
facebook privacy policy 2016,deadline tomorrow facebook snopes,0.38705392908440728
how to privacy on facebook,fb friends privacy settings,0.8047666147737198
instagram app,instagram login,0.35219115291923586
facebook photo security settings,how to change album privacy on facebook android,0.7341510130720188
privacy settings google,what are privacy settings,0.4049723653030653
how can i see what my profile looks like to other people,who can see my photos on facebook timeline,0.3542452647228137
how to change album name on facebook page,how to edit album privacy on facebook using ipad,0.61507968371419397
how to edit facebook page settings,facebook page album privacy,0.5700835771350975
http wwwfacebookcom full site,facebook privacy settings guide,0.32027477743758626
facebook new privacy settings 2016,facebook privacy settings 2015,0.75743905113302856
facebook privacy snopes,facebook privacy settings change,0.4103236049727324
internet privacy speech,internet privacy definition,0.32222920507197306
privacy meaning,privacy options definition,0.50347572224291881
ucc 1104,ucc 1 103 1 308 explained,0.37568673515584516
facebook edit friends list restricted,how to edit custom list on facebook,0.40132294444482886
facebook audience selector not working,how to change the audience for cover photos on facebook,0.55982522222771991
what is archive list on facebook,how to remove custom list facebook,0.46940687077499177
facebook profile picture friends only,who can see my facebook profile picture,0.71481440304936106
view facebook profile without being friends,how can i see what my profile looks like to other people,0.78791032469871192
truste seal,verisign seal,0.51511638421042094
how to change audience for mobile uploads on facebook,how to change the audience for cover photos on facebook,0.77204630329781065
photos of you facebook privacy,how do you make your tagged photos private on facebook,0.71262765655174176
facebook login account open,facebook mobile,0.51396196776261649
facebook page album privacy,how to change privacy setting of album on facebook mobile,0.61036009445578643
how to hide friends list on facebook 2016,facebook friends list privacy mobile,0.59568386890991476
facebook privacy 2016,facebook privacy settings change,0.62181044999420365
verisign inc careers,verisign linkedin,0.37670885401833759
how to hide mutual friends on facebook,how to hide friends on facebook from other friends,0.54155641013004419
how to remove a friend from facebook without them knowing,how to remove custom list facebook,0.50686906600261894
how to hide friends on facebook android,how to change friend settings on facebook app,0.64421498897213347
how to hide my facebook friends list on mobile,facebook friend list privacy only me,0.66129973639725159
who has viewed my facebook profile,how can i see who views my facebook profile for free,0.63006001813327339
how to make tagged photos private on facebook timeline,how to make tagged photos private on facebook,0.80282371277209763
facebook full site,facebook custom list visibility,0.40902833888984291
change in facebook privacy policy 2016,facebook privacy change 2016,0.50705541323338621
photos of you facebook hide,how do you make your tagged photos private on facebook,0.71128853219207988
facebook sign up,http wwwfacebookcom full site,0.36813186581774515
how to hide photos of you album on facebook,how to hide photos of you on facebook,0.63875307619699795
facebook account settings problem,facebook settings page,0.62585947567648337
create friend list facebook iphone app,how do i create a friends list on facebook mobile,0.58722524601394488
facebook public entity 2016,facebook privacy change 2016,0.34378866762758026
snopes facebook hacker warning,facebook hoax meme,0.47901909534597115
facebook hoax 2016,facebook hoax meme,0.50141207878627836
how to delete smart lists on facebook,how to remove custom list facebook,0.43434397601341129
facebook mobile uploads privacy,how to make photo albums private on facebook mobile,0.69248719940258519
custom privacy facebook mobile,custom privacy on facebook,0.50292957589763687
facebook delete list not archive,how to remove custom list facebook,0.41864047852831343
facebook privacy notice,is the facebook privacy post real 2015,0.35740861234993448
how to create custom list on facebook,custom privacy on facebook,0.55858723947831679
facebook login mobile,facebook mobile,0.48861714880861584
how to make friends list private on facebook android,how to hide friends on facebook iphone,0.58978612292479493
create new google account,privacy settings google,0.50062977336284986
how can i hide my friends list on facebook,how to hide friend list on facebook from public,0.63342668856087225
what does norton secured mean,verisign seal,0.51376786871183733
how to hide friend list on facebook from public,facebook friends list privacy mobile,0.57744500324738479
facebook friend list privacy only me,facebook privacy settings friends list,0.61602870754665884
definition of privacy in healthcare,privacy meaning,0.31832691839050731
how to add someone to restricted list on facebook,facebook edit friends list restricted,0.36823899602588317
how to hide albums on facebook,how to hide photos of you on facebook from public,0.66269314065751395
how to know who visited my facebook profile recently,how can i see who views my facebook profile for free,0.41813994553941675
how can i see what non friends see on facebook,can non friends see facebook timeline,0.65432119110275755
how to hide friends in facebook 2016 mobile,how to hide friends list on facebook 2016,0.69575516004644478
create custom list facebook app,how do i create a friends list on facebook mobile,0.39506887327301193
how to hide friends list on facebook samsung,facebook friends list privacy mobile,0.57713534057919347
how to rearrange photos in facebook album on iphone,how to edit album privacy on facebook using ipad,0.51812260758758
computer privacy issues articles,computer privacy issues,0.49734638215533128
how to hide photos on facebook from certain friends,how to hide photos of you on facebook from public,0.61966083627802837
how to hide profile picture on facebook from some friends,who can see my facebook profile picture,0.76312425549461893
top 9 friends on facebook 2015,who shows up on my facebook friends list,0.6073462489201481
instagram login with facebook,instagram login,0.3426972729192837
is it true about facebook privacy,facebook privacy settings 2016,0.55075016126151133
browser privacy settings definition,privacy settings meaning,0.45317831935786418
facebook setting for mobile,facebook settings page,0.51392296180526476
