verisign wiki,verisign ssl,0.43885236459042387
where is the audience selector on facebook timeline,audience selector tool not working facebook,0.48504215091278025
is the facebook privacy post real 2015,facebook privacy change 2016,0.52095758738202902
how to block photos on facebook from friends,how to block someone from seeing tagged posts on facebook,0.70804484282668512
symantec safe site,verisign seal,0.44793294514584509
how do i make my photos private on facebook from my phone,how to make your facebook albums private,0.6881741393082853
internet privacy protection,computer privacy definition,0.3861685933099791
verisign reston,verisign headquarters,0.38995954647790226
google account settings,privacy settings google,0.31910630289458214
how to make a post public on facebook,how to change audience on facebook timeline,0.52478836290582032
verisign inc investor relations,verisign linkedin,0.33491726851801168
snopes facebook charging 2016,facebook hoax meme,0.51605901421276168
how can i hide friends list on facebook,how to hide my facebook friends list on mobile,0.67190605500639056
how to edit audience list on facebook,how to edit custom audience on facebook,0.57070503545604112
how to create friends list on facebook app,custom privacy facebook mobile,0.34217289797311612
how to hide photos on facebook from one person,how to hide photos of you on facebook from friends,0.66871868892040653
how to block photos on facebook from non friends,how to block someone from seeing tagged posts on facebook,0.83116707279438284
internet privacy software,internet privacy definition,0.42661520992477381
computer privacy issues definition,computer privacy issues,0.48468119414563049
facebook your current profile picture is always public,who can see my facebook profile picture,0.6551705556777373
without prejudice ucc 1308 on driver license,ucc 1 103 1 308 explained,0.32018056703359649
how to hide one friend on facebook,how to hide friends list in facebook,0.67999290776897159
create friend list facebook android,how to edit friends list on facebook android,0.61200611324014353
how to hide friends on facebook from other friends,facebook friends list privacy mobile,0.61770314982985486
how to edit friends list on facebook android,facebook privacy settings friends list,0.61477812322028524
facebook friends list order,how to edit friends list on facebook mobile,0.40743736437114203
friend list only me,facebook friend list privacy only me,0.60514986229780143
facebook deadline tomorrow snopes,channel 13 news facebook hoax,0.34222763018738794
threats to privacy,computer privacy issues,0.34843996798700888
custom privacy on facebook,how to change facebook privacy settings,0.759113041687971
can non friends see facebook timeline,who can see my photos on facebook timeline,0.64488004458090042
what is computer privacy,privacy options computer definition,0.31771954857872864
how to block photos on facebook from everyone,how to block someone from seeing your pictures on facebook,0.74231806994639449
restricted list facebook will they know,facebook edit friends list restricted,0.48310440300076363
facebook account settings wrong password,facebook settings page,0.4563008443389216
can anyone see my custom lists on facebook,audience selector facebook mobile,0.65277671827274941
privacy options definition,what are privacy settings,0.42656064521734
verisign stock news,what was verisigns closing price on july 1 2015,0.37540777738189718
define privacy and confidentiality,personal privacy definition,0.35120116368068982
limited profile facebook,facebook edit friends list restricted,0.39255757694582427
verisign g5 root certificate download,verisign certificate download,0.47433247458714234
how to hide friends list on facebook on iphone 6,how to hide friends on facebook iphone,0.56162351036579605
cyber privacy definition,computer privacy definition,0.34045779010910554
top 6 friends on facebook app,who shows up on my facebook friends list,0.65010721439399699
view my whatsapp profile,how can i see what my profile looks like to other people,0.34721927768048444
i dont want anyone to see my facebook profile,only me can see my friends on facebook,0.6055390215906119
what is online privacy,computer privacy definition,0.41083604062802886
facebook sign in my account,facebook sign up,0.41917246332114289
is facebook making posts public,who can see my posts on facebook,0.53790050723103322
google account change password,privacy settings google,0.3797733079215499
where is verisign located,what was verisigns closing price on july 1 2015,0.48150225156588483
wants to share with you on facebook,audience selector facebook mobile,0.47811367501321994
how to hide a tagged photo from someone on facebook,how to hide photos of you on facebook from friends,0.60552285973940423
how to hide photos of you on facebook from friends,how to hide photos of you on facebook,0.64138292444313605
how to hide profile picture on facebook from public,who can see my facebook profile picture,0.68343877107506223
how to change the audience for profile photos on facebook,how to change the audience for cover photos on facebook,0.69293959658992621
9 friends on facebook profile meaning,who shows up on my facebook friends list,0.70302098607615982
who can see custom posts on facebook,custom list facebook who can see,0.57936368365706492
privacy issues with technology,computer privacy issues,0.41693156515549568
facebook wall views,how can i see who views my facebook profile for free,0.50021451673147921
what is a smart list on facebook,how to delete smart lists on facebook,0.42363547316791605
photos of you facebook gone,how do you make your tagged photos private on facebook,0.60586832911466271
facebook friends list hide setting,fb friends privacy settings,0.76495047054127163
how to make photo albums private on iphone,how to make photo albums private on facebook mobile,0.38106482332432706
how to hide friend list on facebook from mobile,how to hide friends list in facebook,0.58163415699724752
facebook privacy changes july 2016,facebook privacy settings 2016,0.63191849138468259
how to make photos of you private on facebook,how to make your facebook albums private,0.70289105341244384
can my friends see posts im tagged in,who can see photos im tagged in on facebook,0.49079201569263631
facebook business page privacy settings,facebook page album privacy,0.53067198104285918
computer privacy software,what is computer privacy,0.35998158243331463
latest facebook hoaxes,facebook hoax meme,0.62502900268796557
google dashboard,privacy settings google,0.41498803565456216
how to hide friends list on facebook mobile,how to hide friends list on facebook 2016,0.639571651999153
how will facebook going public affect me,facebook legal disclaimer hoax,0.42689114378181031
can non friends see my posts on facebook,can non friends see facebook timeline,0.68949480438781618
ucc 1108,ucc 1 103 1 308 explained,0.3059589026920016
mobile uploads facebook album,how to change privacy settings for mobile uploads,0.36201635052421227
how to make my profile picture private on facebook,who can see my facebook profile picture,0.60832049753456974
how to hide photos on facebook from public 2015,how to hide photos of you on facebook from public,0.70059662572600367
who can see my friends on facebook mobile,how to hide friends list in facebook,0.73413451720828149
facebook photo privacy settings,how to change privacy settings on facebook photos of me,0.85232668267796319
privacy definition nursing,privacy meaning,0.31777272785405536
how to edit friends list on facebook mobile,how to edit custom list on facebook,0.40951565630423759
who can see my posts on facebook,who can see my photos on facebook timeline,0.64224177205795829
how to hide tagged posts on facebook from certain friends,how to hide tagged photos on facebook from certain friends,0.63525335680925443
how can i hide my friends list on facebook mobile,no one can see my friends list on facebook,0.73246442900043829
how to hide tagged photos on facebook timeline,how to hide tagged photos on facebook from everyone,0.61283368886419287
computer privacy wikipedia,what is computer privacy,0.38757951763424631
facebook mobile,http wwwfacebookcom full site,0.40655980598228408
what are privacy issues,computer privacy issues,0.44664947834012997
only me can see my friends on facebook,facebook friend list privacy only me,0.74110492197887257
what does no friends to show mean on facebook,no one can see my friends list on facebook,0.66552710233956713
facebook install now,facebook app,0.47919343326000546
my facebook friends list hide,facebook friend list privacy only me,0.64895257549860008
how to edit friends list privacy on facebook mobile,facebook privacy settings friends list,0.8001418957553218
top 6 friends on facebook,who shows up on my facebook friends list,0.65856501950663648
google account recovery,privacy settings google,0.50721037658947254
facebook privacy settings change,facebook privacy settings 2015,0.74065497832847993
change album privacy facebook android,how to edit album privacy on facebook using ipad,0.74186722497951818
how to make tagged photos public on facebook,how do you make your tagged photos private on facebook,0.70631687631899531
how to make an album private on facebook business page,how to make photo albums private on facebook mobile,0.6054704754221385
symantec root certificate,verisign certificate download,0.56472885605023015
how to edit photo album on facebook mobile,how to edit album privacy on facebook using ipad,0.58294712434307538
how to hide photos on facebook 2016,how to hide friends list on facebook 2016,0.76454832006034212
facebook friends list on profile,how to edit friends list on facebook mobile,0.40843706837509236
how to hide photos on facebook from everyone,how to hide photos of you on facebook from public,0.55179809630668175
what does my facebook look like to non friends mobile,how can i see what my profile looks like to other people,0.71283987992319309
how to see who viewed your facebook profile wikianswers,how can i see who views my facebook profile for free,0.57576311677683478
facebook custom list privacy,custom list facebook who can see,0.7024639448116996
how to make mobile uploads private on facebook,how to make photo albums private on facebook mobile,0.53204116497572884
facebook friends privacy settings,fb friends privacy settings,0.86853315043799362
computer privacy definition,privacy options computer definition,0.51612285328115881
how to change audience on facebook timeline,you can change the audience for each photo in this album,0.59878312580637583
9 friends on facebook profile meaning 2015,who shows up on my facebook friends list,0.72321387410904237
how to change custom settings on facebook,how to edit custom list on facebook,0.62189689444893326
how to hide photos on facebook from non friends,how to hide photos of you on facebook from public,0.67683983738790787
facebook search by city,facebook search,0.38922290378877289
facebook search by phone number,facebook search,0.30787644061549446
personal privacy on the internet,personal privacy,0.55934942295805101
how to make albums private on facebook mobile,how to change album privacy on facebook android,0.55174081303311062
nothing to show on facebook photos,no one can see my friends list on facebook,0.62838993648169106
how to hide pictures on facebook from certain friends,how to hide tagged photos on facebook from certain friends,0.63402669537850109
verisign symantec,verisign linkedin,0.59317610323558834
how to make albums on facebook,how to make your facebook albums private,0.61554175912401188
facebook settings page,facebook privacy settings change,0.63316309143554084
facebook privacy statement,facebook new privacy settings 2016,0.45545847174670667
facebook audience selector custom,audience selector tool not working facebook,0.56459169807017617
how to block tagged photos on facebook,how to block someone from seeing your pictures on facebook,0.68877543483719861
how to make profile picture unclickable,who can see my facebook profile picture,0.47920378513799383
how to hide photos im tagged in on facebook,how to hide photos of you on facebook,0.51028532197390553
who can see my newsfeed on facebook,who can see what others post on your timeline,0.38020896641996543
who can see my profile on facebook,who can see my photos on facebook timeline,0.55942264843715783
where is the audience selector on facebook,how to change audience on facebook timeline,0.61520662595898978
channel 13 news facebook privacy hoax,facebook privacy change 2016,0.3751366978808795
how to change privacy settings for mobile uploads,how to change privacy setting of album on facebook mobile,0.54467739062186216
facebook privacy hoax snopes,channel 13 news facebook hoax,0.39838402308622989
how to hide old tagged photos on facebook,how to hide photos of you on facebook,0.61022014448816397
facebook restricted list edit,facebook edit friends list restricted,0.35839599681435064
facebook friends only me setting,facebook friend list privacy only me,0.74951485741452994
facebook privacy change 2016,facebook privacy settings 2016,0.43510108271713915
facebook privacy change october 2016,facebook privacy changes june 2016,0.51972499913498804
why are my mobile uploads public on facebook,how to change privacy settings for mobile uploads,0.47773950984191971
who can see public posts on facebook,how to change audience on facebook timeline,0.57232265641532376
facebook smart list notifications,how to delete smart lists on facebook,0.44141915953198224
how to delete lists on facebook 2015,how to delete smart lists on facebook,0.498926792833774
how to change album privacy on facebook mobile,how to change privacy setting of album on facebook mobile,0.6059006808591797
how to hide friends list on facebook app iphone,facebook friends list privacy mobile,0.65578023153990772
how to share a post with only one person on facebook,custom list facebook who can see,0.48083892243236842
facebook share with friends except,custom list facebook who can see,0.65171675409571039
no public option on facebook,who can see my posts on facebook,0.37955327175698689
how to block someone from seeing tagged posts on facebook,how to hide tagged photos on facebook from certain friends,0.55133300556161646
facebook mobile photo uploads,how to make photo albums private on facebook mobile,0.52860439470754816
how to block someone from seeing your pictures on facebook,how to hide tagged photos on facebook from certain friends,0.56141257708757464
facebook settings language,facebook settings page,0.45649910941530958
how to hide friends on facebook on samsung,how to hide friends list on facebook 2016,0.65496198827266638
facebook privacy settings 2016,how to change facebook privacy settings,0.80849241609723288
facebook privacy settings 2015,how to change facebook privacy settings,0.77452963462029001
how to block non friends on facebook from seeing your photos,can non friends see facebook timeline,0.71434260151799633
how to know who visited my facebook profile not in friends list,how can i see who views my facebook profile for free,0.65085710822727449
how to change friend settings on facebook app,facebook privacy settings friends list,0.77537033378701714
how to hide friends on facebook mobile 2015,facebook friends list privacy mobile,0.65968335679706536
who can see my facebook profile picture,who can see my photos on facebook timeline,0.42851695271256207
facebook profile friends list order meaning,who shows up on my facebook friends list,0.63746167403612575
facebook restricted list,audience selector facebook mobile,0.44508613035806865
how to delete facebook friends fast,how to remove custom list facebook,0.42367951231993217
how to block people from seeing tagged photos on facebook,how to hide tagged photos on facebook from certain friends,0.61804331469513973
facebook search for people without logging in,facebook search,0.39021541398122545
verisign india,verisign headquarters,0.43591926944157083
how to hide photos of you on facebook from public,how to change privacy settings on facebook photos of me,0.59865085579618349
how to make photo albums private on facebook mobile,how to change privacy setting of album on facebook mobile,0.50905485114607341
norton secured website list,verisign seal,0.6108545681763301
specific friends on facebook,custom list facebook who can see,0.64226430295485493
instagram download,instagram login,0.35234765336254154
facebook sign up gmail account,facebook sign up,0.39244304453348927
how to hide all my photos on facebook,how to hide photos of you album on facebook,0.76231581119523095
only me can see my friends list,facebook friend list privacy only me,0.69227465192109694
how to hide photos of you on facebook,facebook privacy settings photos,0.59848750473847379
computer privacy examples,what is computer privacy,0.36981874251759367
visit the new facebook hoax,facebook legal disclaimer hoax,0.37895955280753024
facebook custom list visibility,how to edit friends list on facebook android,0.65704966595449332
search facebook without account,facebook search,0.54302940961971291
can restricted friends on facebook post on your wall,facebook edit friends list restricted,0.4427185117573964
privacy definition law,privacy meaning,0.44236965014542151
how to edit custom list on facebook app,custom privacy on facebook,0.6159536417875735
verisign root certificate install,verisign certificate download,0.35026191505275828
facebook page privacy settings,facebook page album privacy,0.6841459969708733
how to make your facebook albums private,you can change the audience for each photo in this album,0.58054016620239279
facebook legal disclaimer hoax,is it true about facebook privacy,0.33442249861920254
legal definition of privacy,personal privacy definition,0.52807634465380604
who viewed my facebook profile the most,how can i see who views my facebook profile for free,0.36834740444480923
how to hide friend list on facebook on phone,how to hide friends on facebook iphone,0.53382876873545526
facebook privacy hoax 2016,what is the facebook privacy hoax,0.52022680809748778
how to delete friend off facebook,how to remove custom list facebook,0.47859673585218837
how to make facebook albums private 2016,how to make photo albums private on facebook mobile,0.58677431689017623
custom list facebook who can see,custom privacy on facebook,0.63353836156605681
