yahoo mail ssl settings,how to encrypt yahoo email,0.3106266841492179
secure email godaddy,encrypted email providers,0.38063734588066211
protonmail review,encrypted email providers,0.2909864046077249
lavaboom,encrypted email providers,0.15565009998299734
tutanota vs protonmail,encrypted email providers,0.2786482785082543
tutanota review,encrypted email providers,0.34233752120234884
apple mail encryption el capitan,how to encrypt email mac,0.32440567199210602
request a certificate from a certificate authority ca,how to encrypt email mac,0.18163708455923194
create personal certificate mac,how to encrypt email mac,0.30741555394986148
encrypt pdf mac,encrypt gmail attachments,0.27775039000391427
virtru review,encrypt gmail attachments,0.34844576060018684
encrypt pdf free,encrypt gmail attachments,0.27733108520407368
is gmail secure from hackers,gmail end to end encryption,0.37409633684211802
is gmail secure for banking,gmail end to end encryption,0.30900267181204899
mailvelope review,gmail end to end encryption,0.33760576656005425
send files securely dropbox,how to send secure email attachments in gmail,0.28778270286074348
how to install a digital certificate on your computer,outlook encryption certificate,0.29125722227183098
outlook digital id,outlook encryption certificate,0.38772085880041424
snapmail,how to send an encrypted email gmail,0.19755940195939398
send files securely free,how to send a secure email attachment,0.31961352612685534
yahoo mail settings for android,yahoo mail ssl settings,0.3446776601882689
yahoo incoming mail server,yahoo mail ssl settings,0.31044488799951725
yahoo mail imap settings,yahoo mail ssl settings,0.33440869172996485
endtoend chrome extension,yahoo end to end encryption,0.30864336278273036
your voltage software experienced a problem contact your administrator,microsoft outlook cannot sign or encrypt this message because your certificate is not valid,0.20716798592832017
godaddy email login 365,secure email godaddy,0.2715092311395812
yahoo mail settings for outlook,yahoo mail ssl settings,0.40863167560149904
yahoo mail settings for outlook 2016,yahoo mail ssl settings,0.52670831258014306
yahoo mail account settings,yahoo mail ssl settings,0.42121549738235881
yahoo mail settings for outlook 2010,yahoo mail ssl settings,0.50503474856583319
how to configure yahoo mail in outlook 2007,yahoo mail ssl settings,0.46733821889087068
