account recovery,gmail account preferences,0.3504637345661919
google account sign in,gmail account preferences,0.38170097455913143
google settings app,gmail account preferences,0.3947237216760352
chrome settings,gmail account preferences,0.21015154463432847
account preferences,delete my gmail account now,0.33990433064710263
delete account facebook,delete my gmail account now,0.34686632177213689
delete account instagram,delete my gmail account now,0.30309964995156347
gmail inbox pause,how to deactivate gmail account temporarily,0.17552952211422213
delete google account history,delete google account,0.40620465479370821
how to remove google account from lenovo vibe p1m,how to remove gmail account from lenovo phone,0.31481257449779637
lenovo vibe google account bypass,how to remove gmail account from lenovo phone,0.39601878501898835
lenovo p1ma40 google account remove,how to remove gmail account from lenovo phone,0.35857968118468569
google security manager,how to remove google account from android phone from computer,0.33084674547126486
gmail account recovery form,account recovery,0.38009250592359334
gmail forgot password recovery,account recovery,0.33432622372900644
gcorecover password,account recovery,0.2312816353850628
gmail forgot password verification code,account recovery,0.36675393344203511
trouble signing in,account recovery,0.23306564517077108
email login,google account sign in,0.20471783826149317
email sign up,google account sign in,0.21573265971982095
sign in hotmail,google account sign in,0.21260849318648548
create new email account,create new google account,0.40790538310525543
create yahoo account,create new google account,0.25602329464773621
create facebook account,create new google account,0.25588623465540145
change email password,google account change password,0.345656268577126
google settings app set up nearby device,google settings app,0.38780331554465802
google settings app download,google settings app,0.38900150493190772
google settings app install,google settings app,0.38591682885842954
google settings app automatically downloaded,google settings app,0.37516128776915036
google settings app missing,google settings app,0.37956040403457103
google settings apk,google settings app,0.36821655157200106
android settings menu,google settings app,0.33200668684985951
chrome settings url,chrome settings,0.22523999868080763
chrome advanced settings,chrome settings,0.25641100926348581
chrome settings android,chrome settings,0.37267344878505554
chrome settings shortcut,chrome settings,0.21645450819291706
reset settings,chrome settings,0.29876585632395991
chrome settings button missing,chrome settings,0.25142613293765692
reset chrome settings android,chrome settings,0.38676993991791564
browser settings android,chrome settings,0.35518563580069512
delete my facebook account right now,delete account facebook,0.3866472712533997
how to delete facebook account permanently without waiting 14 days,delete account facebook,0.29970376588918646
how to delete facebook account permanently immediately,delete account facebook,0.38841086425121391
how to delete facebook account forever,delete account facebook,0.39629405689649355
delete facebook page,delete account facebook,0.31958062228050998
instagram delete account page,delete account instagram,0.32240388901496309
delete instagram account permanently link,delete account instagram,0.3897023355967697
how to delete instagram account on phone,delete account instagram,0.39658519918389395
instagram deleted my account,delete account instagram,0.37972973008272615
forgot instagram password,delete account instagram,0.28790969139953487
how to delete instagram account on iphone,delete account instagram,0.38649228140533926
how to reactivate instagram,delete account instagram,0.29031013615086743
google account recovery for android,account recovery,0.67973653548566126
google account recovery phone number,account recovery,0.46380294211048206
gmail sign out,google account sign in,0.47898826877427203
gmail login password,google account sign in,0.42398930608034291
email account,google account sign in,0.42107665014781664
create gmail account,google account sign in,0.45793401059610933
gmail sign up,google account sign in,0.52276758188667538
google settings app android device manager,google settings app,0.44783147652361505
google account settings,account preferences,0.74107375078969584
google account recovery,account preferences,0.61520307918320494
how to delete facebook account without password,delete account facebook,0.51672412373653942
how to delete fb account permanently from mobile,delete account facebook,0.4344460460122519
wwwfacebookcomhelpdelete account,delete account facebook,0.42443691302395203
delete your account page,delete account instagram,0.56761294207655599
