how to unfriend someone on snapchat,how to unfriend someone on snapchat,1.0
how do i know if someone deleted me on snapchat,how to unfriend someone on snapchat,0.80588372069602909
if i delete someone on snapchat am i still on their list,how to unfriend someone on snapchat,0.85980383098153723
when you delete someone off snapchat do they appear on your added me list,how to unfriend someone on snapchat,0.85776487375734523
what happens when you delete someone on snapchat,how do i know if someone deleted me on snapchat,0.84256708148945403
if i delete someone on snapchat can they still see my story,if i delete someone on snapchat am i still on their list,0.85100698165615951
how do you know if someone deleted their snapchat app,if i delete someone on snapchat am i still on their list,0.80228197455719108
if you delete someone on snapchat can you add them back,when you delete someone off snapchat do they appear on your added me list,0.88758770914995244
someone deleted me on snapchat but it says they added me back,when you delete someone off snapchat do they appear on your added me list,0.82540868996378836
if you re add someone on snapchat will they know,if you delete someone on snapchat can you add them back,0.86431658394332733
someone added me on snapchat but i cant add them back,someone deleted me on snapchat but it says they added me back,0.84243187371446138
