how to change snapchat privacy settings,how to change snapchat privacy settings,1.0
why cant i see my friends snapchat story,how to change snapchat privacy settings,0.8099059069206529
how to tell if someone blocked you from seeing their story on snapchat,how to change snapchat privacy settings,0.83428322136318966
if you delete someone on snapchat can they still see your story,how to change snapchat privacy settings,0.83783653250078949
how to stop seeing someones story on snapchat,how to change snapchat privacy settings,0.84883626060957718
why cant i see someones snapchat story,why cant i see my friends snapchat story,0.90054307275676826
how to see snapchat story without being friends,why cant i see my friends snapchat story,0.87461625447415037
why cant i see someones snapchat story but they can see mine,why cant i see my friends snapchat story,0.83402555816030677
if i block someone from seeing my story can i still see theirs,how to tell if someone blocked you from seeing their story on snapchat,0.80766116038295521
if you block someone from seeing your story can you still see theirs,how to tell if someone blocked you from seeing their story on snapchat,0.86793604614945807
if you delete someone on snapchat can they still snap you,if you delete someone on snapchat can they still see your story,0.8145136276432321
if you delete a snapchat story can anyone see it,if you delete someone on snapchat can they still see your story,0.840177781065094
why cant i see someones snapchat story if we are friends,why cant i see someones snapchat story,0.87879220363242461
