how to protect against email monitoring,how to protect against email monitoring,1.0
how to protect against phishing,how to protect against email monitoring,0.72884977944534735
how can you identify a phishing email,how to protect against email monitoring,0.60674818076788894
how to protect yourself against phishing threats,how to protect against email monitoring,0.7236970118692958
phishing email warning template,how to protect against email monitoring,0.57971304906583876
phishing attack examples,how to protect against email monitoring,0.65315230325086637
how to stop phishing emails outlook,how to protect against email monitoring,0.53501511930141954
how to stop phishing emails in gmail,how to protect against phishing,0.53926374498637919
which of the following is a legitimate email,how can you identify a phishing email,0.56273139922057114
how to detect phishing attacks,how can you identify a phishing email,0.66996846734769744
what can you do to protect yourself against phishing,how to protect yourself against phishing threats,0.67811400499261199
templates for communicating with your users during spam virus or phishing outbreaks,phishing email warning template,0.55056033650165881
phishing awareness email,phishing email warning template,0.62765973468301339
phishing attack definition,phishing attack examples,0.59766807086897733
types of phishing attacks,phishing attack examples,0.5903540642728371
types of phishing attacks ppt,phishing attack examples,0.61340676907808334
malware based phishing,phishing attack examples,0.53655760115906292
phishing attacks 2016,phishing attack examples,0.54932631242029928
outlook 2016 phishing button,how to stop phishing emails outlook,0.51485233048190149
gmail phishing email example,how to stop phishing emails in gmail,0.56436561148014086
which of the following are not consequences of phishing,which of the following is a legitimate email,0.53454056111651949
spear phishing differs from phishing in that the email comes from someone,which of the following is a legitimate email,0.51008441809369764
