forgot instagram password,how to uninstall instagram,0.19975767548222012
forgot instagram password and email,forgot instagram password,0.20408684048782585
instagram password reset hack,forgot instagram password,0.34580485574519687
instagram password hack,forgot instagram password,0.34365269962837691
instagram password finder,forgot instagram password,0.32728162328704147
forgot instagram username,forgot instagram password,0.31524546121142605
delete account telegram,instagram delete account page,0.25835890280284513
uninstall app mac,how to uninstall app in android,0.2613505542522217
how to disable samsung pay note 5,how to uninstall apps on galaxy s6,0.3330545795723876
disable samsung pay notifications,uninstall samsung pay,0.31681551958181647
galaxy s7 bloatware list,galaxy s6 bloatware to disable,0.34436519724337511
samsung bloatware list,galaxy s6 bloatware to disable,0.34507179768389235
samsung bloatware list s5,galaxy s6 bloatware to disable,0.34711653098004325
galaxy s4 bloatware list,galaxy s6 bloatware to disable,0.34242908177658726
how to remove instagram from facebook favorites,how to uninstall instagram from facebook,0.32462187260712178
how to uninstall apps on iphone 6,how to uninstall instagram on iphone,0.44740114916218776
uninstall samsung pay,how to uninstall instagram on galaxy s6,0.46556517385869117
galaxy s6 bloatware to disable,how to uninstall instagram on galaxy s6,0.42968450905324923
disable samsung pay s7,how to uninstall instagram on galaxy s6,0.42880438432599322
i forgot my instagram password and used a fake email,forgot instagram password,0.35772768108849773
how to get instagram password hack,forgot instagram password,0.43522823513827796
reset instagram password using facebook,forgot instagram password,0.42502856893367247
delete account facebook,instagram delete account page,0.48441507908020354
how to uninstall apps on iphone 7,how to uninstall apps on iphone 6,0.4783012857415101
how to uninstall apps on iphone 6s ios 10,how to uninstall apps on iphone 6,0.39302035429807136
how to uninstall apps on iphone 6 ios 10,how to uninstall apps on iphone 6,0.42663807282070537
how to uninstall apps on ios 10,how to uninstall apps on iphone 6,0.43951306041710386
how to uninstall apps on iphone ios 10,how to uninstall apps on iphone 6,0.4811828837187046
how to delete preinstalled apps on android,how to uninstall app in android,0.45173195714192138
how to uninstall apps on android that wont uninstall,how to uninstall app in android,0.47274538076420558
how to permanently delete apps from icloud,how to delete apps on iphone permanently,0.49219479254830062
how to delete songs from ipad mini,how to uninstall apps on ipad mini,0.37336395322396976
iphone apps stuck on waiting,how to delete an app on ipad that says waiting,0.39962449231261898
app says waiting and wont download,how to delete an app on ipad that says waiting,0.43484345939400587
apps say waiting after restore,how to delete an app on ipad that says waiting,0.4426113816151464
apps stuck on loading,how to delete an app on ipad that says waiting,0.37715283461097843
itunes music download stuck on waiting,how to delete an app on ipad that says waiting,0.41485634874067945
uninstall samsung pay galaxy s6,how to uninstall apps on galaxy s6,0.37653657900909909
uninstall samsung apps s5,how to uninstall apps on galaxy s6,0.3963313280347045
uninstall samsung apps galaxy s6,uninstall samsung pay,0.43895232797814876
uninstall samsung pay galaxy s7,uninstall samsung pay,0.38253980953173977
cant disable samsung pay,uninstall samsung pay,0.41303233378842569
disable galaxy apps,galaxy s6 bloatware to disable,0.46908816150440863
remove samsung bloatware without rooting,galaxy s6 bloatware to disable,0.37502371135180573
galaxy s7 bloatware removal,disable samsung pay s7,0.4052881572201632
samsung galaxy s7 bloatware list,disable samsung pay s7,0.40808736199179685
how to uninstall samsung pay s7,disable samsung pay s7,0.45294665703720788
s7 edge bloatware reddit,disable samsung pay s7,0.35530899890379808
samsung galaxy s6 bloatware,galaxy s6 apps to disable,0.39358321106188821
how to disable samsung pay,galaxy s6 apps to disable,0.40037142168312018
samsung galaxy s6 pre installed apps,galaxy s6 apps to disable,0.45087174717443362
disable samsung pay s7 edge,remove samsung pay from s7,0.44168035307156278
instagram stuck on waiting,cant uninstall instagram iphone,0.4818627080426367
how to disconnect instagram from facebook on android,how to uninstall instagram from facebook,0.44084791765320563
how to disconnect facebook from instagram 2016,how to uninstall instagram from facebook,0.43288094271512895
how to permanently uninstall apps on iphone,how to uninstall apps on iphone 6,0.59627395023740448
how to delete apps on iphone 6 permanently,how to uninstall apps on iphone 6,0.59124566308701376
