delete your snapchat account,0.87140397399799285
what happens when you delete snapchat account,0.84061893961006351
delete snapchat chat account,0.88692242782024555
snapchat support delete account,0.80621951204955544
how to deactivate snapchat,0.93166954660000001
if i delete my snapchat will it delete sent snaps,0.62762163585736741
snapchat com delete account,0.9081183422868031
how to deactivate snapchat 2016,0.85648299181140208
snapchatcom delete account,0.7811044957556661
how to deactivate snapchat android,0.88274020549993804
how to delete snapchat account on iphone,0.88405311498365424
how to delete snapchat,0.64856216464263561
how to delete snapchat account android,0.80528178809975015
