government monitoring social media,government monitoring social media,1.0
government surveillance of social media,government monitoring social media,0.68875263411849352
against government monitoring social media,government monitoring social media,0.86590194702049517
us government monitoring social media,government monitoring social media,0.88967869120735066
reasons why the government should monitor social media,government surveillance of social media,0.73840914398346968
social media and human rights violation,against government monitoring social media,0.68314818933524468
