what is a snapchat score,snapchat unfollow app,0.34324248273677471
how to delete snapchat conversations,if you delete a snapchat story can anyone see it,0.53379778003128853
why is someone i deleted from friends appear under the added me menu sayin added you back,what does added you back mean on snapchat,0.58629722385984917
reset snapchat account,mass delete snapchat friends,0.31552927796343916
mass snapchat adder,mass delete snapchat friends,0.31104364315277344
how to unsync contacts from snapchat,mass delete snapchat friends,0.34681643002777335
how to delete all friends on facebook,mass delete snapchat friends,0.3549469189853548
if you unfriend someone on snapchat will you lose your streak,if you delete someone on snapchat can they still see your story,0.51307319249523498
how to know if someone follows you back on instagram,how to know if someone added you back on snapchat,0.36660947565033902
how to know if youve been blocked on iphone,how to know if youve been blocked on snapchat,0.4589077888851763
snapchat sorry couldnt find,how to know if youve been blocked on snapchat,0.50855649091322441
what happens when you unblock someone on snapchat,how to know if youve been blocked on snapchat,0.55555735438867482
if someone deletes their snapchat will it say pending,how do you know if someone deleted their snapchat app,0.57577313329736157
if i uninstall snapchat will i lose everything,how do you know if someone deleted their snapchat app,0.54655252490382678
if i delete the snapchat app will it delete my memories,how do you know if someone deleted their snapchat app,0.56569092689053724
snapchat score booster,what is a snapchat score,0.27281982545722994
highest snapchat score record,what is a snapchat score,0.25798756686021268
hide snapchat score,what is a snapchat score,0.47761789043834901
snapchat contact number,what is a snapchat score,0.41966598214894663
snapchat score not updating,what is a snapchat score,0.48678803156420275
how to get snapchat trophies,what is a snapchat score,0.22117050531330709
snapchat score bot,what is a snapchat score,0.34229302183826632
snapchat score hack iphone,what is a snapchat score,0.34749213100624421
added me list snapchat,how to unfollow someone on snapchat without them knowing,0.60506024728923691
if you unfriend someone on snapchat will you keep your streak,if you unfriend someone on snapchat can they see your story,0.62098432776144497
how to delete snapchat story with new update,if you delete a snapchat story can anyone see it,0.61440936994765472
could not delete story,if you delete a snapchat story can anyone see it,0.63005741525591419
how do you know if someone unfollows you on snapchat,added me list snapchat,0.63499907804665567
added me snapchat,what does added you back mean on snapchat,0.62323036900412498
snapchat users who added me delete,added me list snapchat,0.76469663197317461
someone added me on snapchat but i dont know who it is,added me list snapchat,0.72773402244249563
how do you know if someone accepts you on snapchat,added me list snapchat,0.67462859863297364
when someone adds you on snapchat,added me list snapchat,0.74907656103494458
