how to uninstall snapchat,how to uninstall snapchat,1.0
how to deactivate snapchat temporarily,how to uninstall snapchat,0.67640051449371219
how to delete snapchat messages,how to uninstall snapchat,0.73038155018452777
what happens when you delete snapchat account,how to uninstall snapchat,0.807051914857562
how to reactivate snapchat account,how to deactivate snapchat temporarily,0.73355600153225031
if i delete my snapchat will it delete sent snaps,how to deactivate snapchat temporarily,0.71275103834514753
how to delete snapchat account android,how to deactivate snapchat temporarily,0.8070474794346405
how to delete snapchat conversation history,how to delete snapchat messages,0.66603201853767946
delete snapchat chat account,how to delete snapchat messages,0.85139816419475023
how to delete snapchat text messages,how to delete snapchat messages,0.74359192096196847
how to delete snapchat chats permanently,how to delete snapchat messages,0.82221565725235624
support snapchat delete account,what happens when you delete snapchat account,0.74552001155356107
how to delete a snap,how to delete snapchat account android,0.80436845421791159
how to delete messages on snapchat that the other person saved,how to delete snapchat text messages,0.71796614960563454
