how to encrypt whatsapp,how to encrypt whatsapp,1.0
how to read encrypted whatsapp messages,how to encrypt whatsapp,0.66728318546809184
whatsapp encryption method,how to encrypt whatsapp,0.73619861641541362
whatsapp encryption iphone,how to encrypt whatsapp,0.72413331388549296
how end to end encryption works,how to encrypt whatsapp,0.65283594259576505
end to end encryption in whatsapp,whatsapp encryption iphone,0.70161325257256646
end to end encryption whatsapp,how end to end encryption works,0.74807868942453126
end to end encryption app,how end to end encryption works,0.66088248109889736
