how to protect against skype monitoring,how to protect against skype monitoring,1.0
does skype monitor video calls,how to protect against skype monitoring,0.72897311769652051
can someone record you on skype without your knowledge,how to protect against skype monitoring,0.62978151106023039
can skype calls be recorded without notice,how to protect against skype monitoring,0.71581420705034393
can a third party record skype video calls,how to protect against skype monitoring,0.7515836278132364
are skype calls monitored or recorded,does skype monitor video calls,0.80270994995974698
is skype video call recorded,does skype monitor video calls,0.78853624094768759
are skype video calls saved anywhere,does skype monitor video calls,0.67465537377989027
record skype video free,can a third party record skype video calls,0.71460564839619911
how to record skype calls on android,can a third party record skype video calls,0.65572186910582686
record skype calls mac,can a third party record skype video calls,0.66197471063657765
how to record skype video calls on iphone,can a third party record skype video calls,0.73039604484115384
how to record skype calls on iphone,can a third party record skype video calls,0.73269509287332268
are skype video calls private,can a third party record skype video calls,0.69264489657033501
best skype video recorder,can a third party record skype video calls,0.80280355295204953
skype video call privacy,is skype video call recorded,0.64540176556470141
are skype calls monitored,is skype video call recorded,0.74796110292035833
best skype recorder,is skype video call recorded,0.72198503014923354
can skype calls be recorded by third party,are skype video calls saved anywhere,0.73084512330698448
are video calls recorded,are skype video calls saved anywhere,0.7835133831486617
