how to reinstall pokemon go,delete pokemon go app,0.56240030187090762
niantic website,how to restart pokemon go account,0.15918838250605219
pokemon forgot username,reset pokemon go password,0.51977119886390888
pokemon trainer club change password,reset pokemon go password,0.56123716108568389
forgot pokemon player id,reset pokemon go password,0.51776235041873109
reinstall app without losing data android,if i delete pokemon go will i lose my progress,0.34801278956052373
reinstall pokemon go,if i delete pokemon go will i lose my progress,0.56241264449414474
niantic contact,niantic website,0.21385952554016571
niantic phone number,niantic website,0.2219015744025753
niantic labs pokemon go,niantic website,0.42851939200454375
niantic labs twitter,niantic website,0.31535193271816397
niantic stock,niantic website,0.25281419299520896
niantic ingress,niantic website,0.26779536510935903
niantic server status,niantic website,0.29670490634035579
niantic share price,niantic website,0.27574004723104628
pokemon trainer club account how to activate account,pokemon account sign up,0.51928781916492761
pokemon trainer creator,pokemon account sign up,0.27631263449707671
pokemon go player id,pokemon go password requirements,0.48177539790166501
what is player id in pokemon go,pokemon forgot username,0.50258176538466859
what is your player id,forgot pokemon player id,0.23829594272267643
player id pokemon go,forgot pokemon player id,0.5549848915312009
my play pokemon,forgot pokemon player id,0.49387978694078671
pokemon go account free,pokemon go account recovery,0.54416896148139438
reset pokemon go password,how to delete pokemongo,0.57911703149484262
pokemon trainer club down,pokemon account sign up,0.58009762168557466
forgot pokemon go password,pokemon forgot username,0.57777641680891034
pokemon go password change,reset pokemon go password,0.64831481477679864
pokemon go password requirements,reset pokemon go password,0.67374222283986229
forgot username pokemon go,reset pokemon go password,0.66583930207506592
forgot password pokemon go,reset pokemon go password,0.66616424760556447
pokemon go password recovery,reset pokemon go password,0.75919125452890424
pokemon go password and username,pokemon go password change,0.67376290938540495
pokemon go reset password,pokemon go password requirements,0.72224146048634186
forgot pokemon go username,pokemon forgot username,0.7146267199614228
pokemon trainer club forgot username,forgot username pokemon go,0.68538599261684652
club pokemon register,pokemon trainer club change password,0.6192514710650231
pokemon go passwords,forgot password pokemon go,0.70782250339712449
what is my pokemon go player id,forgot pokemon player id,0.63716457502665835
forgot player id pokemon go,forgot pokemon player id,0.74227692622402752
what is my pokemon player id,forgot pokemon player id,0.60618883334888807
how to find player id pokemon go,forgot pokemon player id,0.63677573257260189
