how to detect spyware on android phone,0.2609717868338558,0.15601430042129677,-0.06974921630094044
how to remove spyware from phone,0.18025078369905956,0.57704306307699782,-0.18260188087774296
anti spy mobile,0.51724137931034486,8.9097457214669571e-05,-0.04075235109717868
how to read text messages from another phone for free,0.57836990595611293,7.2549719337988721e-06,-0.6026645768025078
how to untap your phone,0.43025078369905961,0.0019514869569550646,0.39655172413793105
number to call to see if cell phone is tapped,0.35031347962382442,0.020190984685110335,0.12695924764890282
how to read someone elses text messages without their phone,0.55172413793103448,2.2406370272321259e-05,-0.49764890282131663
how to tell if your phone is tapped by police,0.20689655172413793,0.39929005592543054,-0.24294670846394983
how do you know if your phone is being tapped,0.31739811912225702,0.045982804221408054,0.11363636363636363
anti spy mobile free,0.62460815047021945,9.0363083103007925e-07,-0.7703761755485894
how to hack your iphone,0.70219435736677116,1.913293240552174e-08,-0.8440438871473355
phone tap detectors,0.84090909090909094,6.3171349519098722e-12,0.8197492163009404
hack a phone with just the number,0.55564263322884022,1.9045831270828513e-05,-0.6833855799373041
how to tell if your iphone is tapped,0.37147335423197497,0.011396300659814963,-0.39184952978056425
how to get someones texts sent to your phone,0.47648902821316608,0.00040596949066950069,0.48589341692789967
how to stop someone from tracking your phone,0.48667711598746083,0.00028112582772762864,-0.4067398119122257
how to hack someones text messages without having their phone,0.41927899686520376,0.0027666689319304359,-0.43495297805642635
how to tell if your landline phone is tapped,0.41379310344827586,0.0032831036560331548,-0.2139498432601881
how to look at someones text messages online,0.2711598746081505,0.12737570306474078,0.30250783699059564
mobile phone hack,0.48510971786833856,0.00029762761093628205,-0.5752351097178683
how to read text messages from another phone without installing software,0.58620689655172409,5.1546678730737916e-06,-0.7280564263322884
anti spy mobile review,0.54153605015673978,3.4003232393986277e-05,-0.31974921630094044
anti spy mobile pro apk,0.62068965517241381,1.0848079216562894e-06,-0.512539184952978
anti spyware for iphone,0.30015673981191221,0.068509506146815585,-0.32053291536050155
how can i tell if someone is spying on my phone,0.2115987460815047,0.37152773364890984,-0.14341692789968652
how to read someones text messages without having their phone,0.37931034482758619,0.0091426117754686807,-0.34717868338557994
certo iphone,0.7719435736677116,4.0695823053495449e-10,-0.8855799373040752
how to remove spyware from android phone,0.23746081504702193,0.24165083543762125,0.02037617554858934
spy text messages free,0.31269592476489028,0.051378310613189884,-0.24921630094043887
