how to delete snapchat story with new update,0.59090909090909083,4.1896787526931075e-06,-0.5909090909090909
how to deactivate instagram on iphone,0.73746081504702199,2.8579139474689213e-09,-0.9075235109717869
if i clear a conversation on snapchat will i lose my streak,0.43181818181818177,0.001855197172791967,-0.4318181818181818
if you clear a conversation on snapchat can the other person still see it,0.59090909090909083,4.1896787526931075e-06,-0.5909090909090909
if you delete a snapchat story can anyone see it,0.79545454545454541,1.0238017263383223e-10,-0.7954545454545454
snapchat sign up page,0.94278996865203768,6.9984929169756731e-15,-0.9545454545454546
how to delete snapchat story 2016,0.38636363636363635,0.0074685776885187218,-0.38636363636363635
how to delete snapchat conversation history,0.75,1.4213670500786056e-09,-0.75
snapchat locked,0.75,1.4213670500786056e-09,-0.75
snapchat create account,0.96551724137931039,1.3792353475224054e-15,-0.932601880877743
snapchat support,1.0,1.0897912713190582e-16,-1.0
how to delete snapchat story android,0.90909090909090906,7.2438030114221158e-14,-0.9090909090909091
how to delete a message on snapchat before they see it,0.45454545454545459,0.00087249742641020268,-0.45454545454545453
how to delete snapchat messages,0.94278996865203768,6.9984929169756731e-15,-0.9890282131661442
how to delete a snapchat sent to the wrong person,0.86206896551724133,1.6385565093300331e-12,-0.920846394984326
delete your account page,0.38479623824451403,0.0078144074887055836,-0.5109717868338558
unlock snapchat account snapchat support,0.70454545454545459,1.6904071172861246e-08,-0.7045454545454546
how to delete a snapchat message before someone sees it,0.52272727272727271,7.1957890122080281e-05,-0.5227272727272727
snapchat support unlock,0.70454545454545459,1.6904071172861246e-08,-0.7045454545454546
if i delete my snapchat will it delete sent snaps,1.0,1.0897912713190582e-16,-1.0
how to delete snapchat message,0.97727272727272729,5.8640970002802483e-16,-0.9968652037617555
delete your snapchat account,0.97727272727272729,5.8640970002802483e-16,-0.9976489028213166
how to delete a snapchat message,0.93181818181818188,1.5118642536799412e-14,-0.9882445141065831
how to reactivate snapchat account,0.93103448275862066,1.5968216536290795e-14,-0.987460815047022
how to delete a snapchat story,0.90909090909090906,7.2438030114221158e-14,-0.9090909090909091
could not delete story please try again,0.25,0.19238085265947563,-0.25
my snapchat story wont delete,0.90909090909090906,7.2438030114221158e-14,-0.9090909090909091
how to delete snapchat story,0.90909090909090906,7.2438030114221158e-14,-0.9090909090909091
support snapchat,1.0,1.0897912713190582e-16,-1.0
how to delete a sent snapchat message,0.82915360501567403,1.3176963166255453e-11,-0.8510971786833855
does blocking someone on snapchat delete the messages they saved from you,0.31818181818181823,0.045133056153488421,-0.3181818181818182
can you deactivate instagram account,0.72413793103448276,5.9258030233561995e-09,-0.8714733542319749
if i block someone on snapchat will it cancel the sent picture,0.84090909090909094,6.3171349519098722e-12,-0.8409090909090909
snapchat sign up,0.96551724137931039,1.3792353475224054e-15,-0.9890282131661442
delete snapchat chat account,0.80485893416927901,5.8270381384117929e-11,-0.9192789968652038
will blocking someone on snapchat delete messages,0.70454545454545459,1.6904071172861246e-08,-0.7045454545454546
how to delete a snapchat that failed to send,0.88636363636363635,3.339020882425075e-13,-0.8863636363636364
how to delete snapchat account on iphone,0.95454545454545459,3.0356915149977056e-15,-0.9945141065830722
snapchat support delete account,0.84090909090909094,6.3171349519098722e-12,-0.9380877742946708
how to delete snapchat history,0.90909090909090906,7.2438030114221158e-14,-0.9843260188087775
how to deactivate snapchat temporarily,0.81818181818181812,2.5927979266758446e-11,-0.8181818181818182
what happens when you delete snapchat account,0.86363636363636365,1.4807110233550846e-12,-0.9459247648902821
snapchat support twitter,0.93103448275862066,1.5968216536290795e-14,-0.9568965517241379
how to delete my snapchat story,0.90909090909090906,7.2438030114221158e-14,-0.9090909090909091
does blocking someone on snapchat delete saved messages,0.38636363636363635,0.0074685776885187218,-0.38636363636363635
reactivate snapchat,0.95454545454545459,3.0356915149977056e-15,-0.9945141065830722
snapchat number,0.89655172413793105,1.6912095724322842e-13,-0.9733542319749217
how to temporarily deactivate snapchat account,0.63636363636363635,5.1869128042882634e-07,-0.6363636363636364
snapchat history eraser,0.5,0.00017183369462081601,-0.5
how to delete a snapchat account,1.0,1.0897912713190582e-16,-1.0
if i block someone on snapchat can they still see my story,0.90909090909090906,7.2438030114221158e-14,-0.9090909090909091
how to delete my story on snapchat,0.90909090909090906,7.2438030114221158e-14,-0.9090909090909091
how to delete a snapchat message you sent,0.95454545454545459,3.0356915149977056e-15,-0.9545454545454546
how to delete a snapchat you sent,0.93181818181818188,1.5118642536799412e-14,-0.9804075235109718
snapchat wont let me delete my story,0.90909090909090906,7.2438030114221158e-14,-0.9090909090909091
snapchat support page,0.79545454545454541,1.0238017263383223e-10,-0.7954545454545454
snapchat support login,0.93103448275862066,1.5968216536290795e-14,-0.9811912225705329
how to delete snapchat conversations,0.90909090909090906,7.2438030114221158e-14,-0.9090909090909091
snapchat sign up not working,0.7931034482758621,1.1774930603882947e-10,-0.6873040752351097
how to delete snapchat text messages,0.89655172413793105,1.6912095724322842e-13,-0.9647335423197492
snapchat reactivate,0.95454545454545459,3.0356915149977056e-15,-0.9945141065830722
how to deactivate snapchat android,0.95454545454545459,3.0356915149977056e-15,-0.9545454545454546
if you send someone a snapchat then delete them,0.82915360501567403,1.3176963166255453e-11,-0.8252351097178683
how to deactivate snapchat,0.97727272727272729,5.8640970002802483e-16,-0.9992163009404389
snapchat download,0.96551724137931039,1.3792353475224054e-15,-0.9976489028213166
snapchat sign up problems,0.96551724137931039,1.3792353475224054e-15,-0.9498432601880877
could not delete story,0.36912225705329149,0.012164168054145542,0.032915360501567396
delete instagram account permanently link,0.67946708463949845,6.201318101754889e-08,-0.7547021943573667
instagram deleted my account,0.82915360501567403,1.3176963166255453e-11,-0.9059561128526645
how to delete a snap story,0.90909090909090906,7.2438030114221158e-14,-0.9090909090909091
reactivate snapchat before 30 days,0.20454545454545459,0.4136292738152399,-0.20454545454545456
how to delete snapchat account android,0.7719435736677116,4.0695823053495449e-10,-0.8894984326018809
