delete your snapchat account,0.87733838465842584
what happens when you delete snapchat account,0.85159484763812121
delete snapchat chat account,0.88839345123451263
snapchat support delete account,0.81103221395449443
how to deactivate snapchat,0.93461326917791343
if i delete my snapchat will it delete sent snaps,0.62070187172782609
snapchat com delete account,0.91186782689211188
how to deactivate snapchat 2016,0.84959203391639782
snapchatcom delete account,0.79081616082534234
how to deactivate snapchat android,0.8748286973709023
how to delete snapchat account on iphone,0.86496301044875734
how to delete snapchat,0.73139182674933156
how to delete snapchat account android,0.84045458061396305
